"APPLICATION_ID","ABSTRACT_TEXT"
"9189958","Neurodevelopmental disorders (NDDs) affect 1 in 10 children in the US and rates are increasing at an alarming rate. Gene-environment interactions are implicated in the pathogenesis of neurodevelopmental disorders (NDDs), including autism spectrum disorder (ASD). Epigenetic changes, such as DNA methylation, are often posited as one mechanism by which genes and environment interact to influence individual NDD risk; however, there is a paucity of experimental data in direct support of this mechanism. The goal of my research is to address this gap in the literature by testing the hypothesis that PCB 95 interacts with heritable mutations in Ca2+ signaling at the level of DNA methylation to modulate Wnt2-dependent dendritic growth and plasticity. To test this hypothesis, I will model a gene-environment interaction relevant to ASD by combining exposure to polychlorinated biphenyl (PCB) 95, an environmental neurotoxicant, and mice with a CGG repeat expansions in the premutation range (<200 repeats) in the fragile X mental retardation gene (Fmr1), which is the single most frequent monogenetic cause of neurodevelopmental impairments, or a novel double knock in (KI) mouse carrying a gain of function mutation in the ryanodine receptor (RyR1T486I) and Fmr1 premutation. The rationale derives from the following published observations: (1) Ca2+ dysregulation and dendritic arborization are characteristics of many NDDs; (2) developmental exposure to PCB 95 increases Ca2+ signaling and Wnt2-dependent dendritic arborization; (3) the gain of function mutation in RyR1T486I and CGG repeat expansions in Fmr1 both enhance intracellular Ca2+ and dendritic arborization. The specific aims are: (1) Test the hypothesis that PCB 95 disrupts dendritic growth in vitro by decreasing nuclear DNMT3B and Wnt2 DNA methylation and these effects are amplified in Fmr1 premutation and KI mouse neurons. (2) Test the hypothesis that DNA methylation serves as a convergence point for PCB 95, and heritable mutations in Ca2+ signaling, combined effects on dendritic growth and plasticity in vivo. This project will yield novel mechanistic data regarding not only the developmental neurotoxicity of PCBs, which are a current risk to the developing human brain, but also the role of the epigenome, specifically DNA methylation, in gene- environment interactions that confer risk for adverse neurodevelopmental outcomes. This information is urgently needed to inform rational strategies for minimizing NDD risk by mitigating relevant exposures in susceptible populations and for identifying novel therapeutic targets. This research experience combined with the training plan developed in consultation with my Sponsor and Co-Sponsor will enhance and extend my predoctoral training and provide me with not only the research tools but also the professional skills required to transition to independence and realize my career goal of becoming an independent investigator in environmental epigenetics."
"9172208","DESCRIPTION       The purpose of this CDA-1 proposal is to provide Dr. Naomi Bramhall with the support and mentorship necessary to make the transition from basic science research to clinical research of noise-induced hearing loss. Dr. Bramhall's previous research has focused on hereditary hearing loss and hair cell regeneration, but as a certified audiologist, she is eager to shift to clinical hearing research. This proposal will provide Dr. Bramhall with the tools and experience necessary to engage in clinical research and generate data which will be used in applying for future funding such as the CDA-2, will guide her path towards independence as a clinical researcher. Her primary mentor for this proposal is Dr. Dawn Konrad-Martin and Dr. M. Charles Liberman is a co-mentor.  Loud noise exposure is routinely experienced during military service and hearing loss is the second most common service-related disability among Veterans. Individuals with hearing loss and poor speech discrimination ability often have little success with  hearing aids because amplifying sound improves the audibility, but not the clarity, of the speech signal. Loud noise exposure may result not only in damage to outer hair cells, but also lead to auditory neuronal degeneration. Neural loss can result in decreased word recognition (Schuknecht 1994) and may explain why many Veterans have poorer speech discrimination than would be expected based on their ability to detect tones, particularly in noisy environments. Mice show rapid degeneration of auditory nerve peripheral terminals followed by a slow degeneration of spiral ganglion neurons over a period of several months following loud noise exposure, even when their pure tone auditory thresholds recover completely (Kujawa and Liberman 2009). The subpopulation of neurons most vulnerable to noise exposure consists of the low spontaneous rate fibers (Furman et al. 2013), which have a high sensitivity threshold and respond to higher intensity sounds. This neuronal loss is correlated with a decrease in the amplitude of the first wave of the auditory brainstem response (ABR). Age-related reduction in the amplitude of wave I has been demonstrated in humans (Konrad-Martin et al. 2012) and is consistent with temporal bone studies showing auditory neuronal loss with age (Makary et al. 2011), suggesting this metric of auditory neuronal survival is also applicable to humans. Previously, quantification of the degree to which auditory neuronal survival influences speech understanding has been difficult due to limitations in measuring auditory neuronal loss in humans, which could only be accomplished through post-mortem temporal bone studies.  The main objectives of this proposal are to use electrophysiological methods to 1) determine if decreased ABR wave I amplitude is associated with noise exposure in humans and 2) examine the impact of noise exposure and decreased wave I amplitude on auditory perception. Our hypothesis is that noise exposure will be associated with decreased wave I amplitude, consistent with animal studies, and that this change will be correlated with decreased speech recognition at high sound levels, difficulty understanding speech in the presence of background noise, and decreased tolerance to loud sounds. Developing the ability to assess auditory neuronal survival with existing clinical tools and advancing our understanding of the specific auditory perceptual deficits resulting from neuronal loss will help guide future treatment options for Veterans suffering from hearing loss."
"9181414","DESCRIPTION (provided by applicant): We advance the hypothesis that hepcidin regulates manganese metabolism. Accumulating evidence from in vitro studies suggests that ferroportin, the target of hepcidin regulation, plays a role in the transport of manganese. Our in vivo studies of Hfe-/- mice strongly support this idea. We will directly test its function in manganese metabolism using flatiron (ffe+/-) mice as a genetic model of ferroportin deficiency. While ferroportin function in iron export by intestinal enterocytes and macrophages of the reticuloendothelial system has been established, its activity has yet-to-be fully explored in hepatocytes where the exporter also is highly expressed. We hypothesize that in the liver, ferroportin functions in biliary excretion of manganese, a known homeostatic pathway that clears excess metal from the body. Based on our model, we speculate that circulating manganese levels are suppressed during inflammation by hepcidin, an idea that is well-supported by known host-pathogen interactions. Finally, we will determine the mechanism responsible for increased olfactory manganese absorption we have observed in Hfe knockout mice. The original new ideas forming the basis of our research will have a powerful sustaining influence on the field of metal metabolism by creating new paradigms to explain the molecular basis for manganese homeostasis."
"9128440","The University of Botswana School of Medicine (UB SoM) enrolled in first class of students in 2009 and began a  residency program in 2010. The School was formed to train doctors who are citizens of Botswana with the hope of  retaining them in country. In prior years, medical students were educated outside the country at the government's  expense; however, less than 15% returned to Botswana. The University of Pennsylvania (Penn) established  collaborations with the Government of Botswana and UB in 2001, which is referred to as the Botswana-UPenn  Partnership. The partnership focuses on building health care capacity in clinical care, education, and research in  Botswana. The goals of this Core are to enhance the education of UB SoM trainees and faculty in clinical  research methodology focused on cervical cancer, and to provide scientific and career mentoring for trainees and  faculty who apply for pilot grant funding. To achieve these goals: 1. We will introduce a career-mentoring program  at UB for faculty and students interested in biomedical research. No such mentoring program currently exists at  UB. Entry into the career-mentoring program will be based on those trainees and faculty who submit a pilot grant  application. All applicants will be offered career mentoring independent of their success in obtaining pilot grant  funding. We distinguish career mentors from scientific mentors in that career mentors are often senior faculty with  successful careers that do not necessarily share scientific interests with their mentees. One senior faculty member  from UB and another from Penn will be identified as career mentors. 2. We will organize an annual educational  workshop in biomedical research methodology for UB faculty and medical trainees We will focus on teaching at an  introductory level about the skills required for biomedical research with an emphasis on epidemiology,  pathogenesis and treatment of cervical cancer, which is the central theme of this application. Lectures will target  UB medical students. Masters of Medicine (MMed) residents working on a research thesis, and UB faculty  interested in biomedical research. 3. We will initiate a mentored pilot grant program that links a UB faculty  member with a UB MMed resident and/or medical student and a scientific mentor from Penn. We are particularly  interested in supporting pilot grant applications that include as a team member UB medical students enrolled in a  novel year-out program for biomedical research funded by the Botswana Government. We will devote one day of  the annual workshop to lectures on manuscript and grant writing, to supervising the faculty and trainees as they  begin to prepare their pilot grant applications, and to helping applicants identify suitable scientific mentors at Penn  for their projects. We will establish performance measures to monitor the success of our programs. The 13-year  commitment of Penn faculty in Botswana and the collegial relationships that have emerged are positive indicators  that this Core will succeed in achieving its research and mentoring goals."
"9256858","PROJECT SUMMARY  The worldwide incidence of obesity and type II diabetes has risen alarmingly over the past few decades. The World Health Organization now estimates that 347 million people are diabetic, and that diabetes- related deaths will rise by 50% over the next 10 years, making it the 7th leading cause of death.1 A hallmark of diabetes is pancreatic beta cell failure, wherein beta cells are unable to secrete enough insulin to maintain normoglycemia. Many mechanisms have been suggested as the cause of this failure, but more recently, dedifferentiation has been identified as a common pathogenic mechanism in murine, primate, and human diabetes. Targeting dedifferentiation as a therapeutic measure is particularly attractive since dedifferentiating beta cells should theoretically be amenable to ?redifferentiation.? However, the causes of dedifferentiation remain unknown. The proposed project seeks to examine whether cytochrome b5 reductase isoform 3 (Cyb5r3) can play a role in this process. Cyb5r3 was identified as a differentially expressed transcript in dedifferentiating beta cells. Moreover, loss of Cyb5r3 was specifically linked to decreased FoxO1 function, a hallmark of beta cell dedifferentiation. Finally, loss of the related isoform Cyb5r4 in mice is known to cause early-onset diabetes independent of insulin resistance. My preliminary work has already established that Cyb5r3 is a direct transcriptional target of FoxO1, and that it is required for the maintenance of mitochondrial basal respiration and glucose-stimulated insulin secretion in vitro. I hypothesize that Cyb5r3 is critical to normal beta cell function in vivo, and that its loss contributes to beta cell dedifferentiation.  I will therefore describe two Specific Aims that seek to further characterize the role of Cyb5r3 in beta cells. First, I propose to corroborate my preliminary data by establishing a Cyb5r3 gain-of-function model, which I predict will partially reverse insulin secretory defects in diabetic mouse islets. I will also study how Cyb5r3 loss-of-function impairs mitochondrial respiration and insulin secretion by examining mitochondrial complex function. Second, I am generating mice lacking Cyb5r3 specifically in beta cells, a model I have termed ?B-Cyb5r3.? The B-Cyb5r3 mice will undergo thorough metabolic phenotyping (e.g. glucose and insulin tolerance tests, hyperglycemic clamp studies), as well as histopathological and functional assessment of islets and beta cells, which we expect will reveal a beta cell-specific defect in insulin secretion. In summary, this comprehensive set of experiments will not only contribute significantly to my development as a scientist but may also prove valuable to the treatment of diabetes."
"9169940","DESCRIPTION (provided by applicant): Social communication is at the heart of successful, healthy social interactions in humans. Social communication deficits are characteristic of several mental health disorders, including anxiety, depression, and autism spectrum disorders. Dysfunction in reward neural systems, including opioid neural systems, has been pro- posed to contribute to social communication deficits characteristic of these disorders, yet little research has focused on the role of reward neural systems in social communication. Furthermore, it is not clear why communication deficits associated with these disorders are observed in some but not other social contexts. One possibility supported by pilot data in a songbird model system is that communication in distinct social contexts is rewarded by distinct mechanisms. The long-term goal of the principal investigator is to identify the neurochemical mechanisms responsible for communication produced in distinct social contexts. The objective of this application is to identif the role of reward and opioid neuropeptides in the medial preoptic nucleus (mPOA) in communication in distinct social contexts. The mPOA regulates affiliative social behavior and communication, and opioid release in mPOA induces reward. In a songbird model, sexually-motivated communication (SMC) can result in immediate external reward (e.g., courtship song results in copulation). In contrast, general social communication (GSC) occurs in social groups in a non-sexual, affiliative context and does not result in immediate overt reward (e.g., copulation), suggesting GSC is linked to intrinsic reward. The central hypothesis sup- ported by strong preliminary data is that GSC is stimulated and maintained by an individual's intrinsic reward state induced by opioid release in mPOA. In contrast, SMC may be reinforced primarily by conspecific responses to song. Four specific aims based on strong pilot data in a songbird model system are proposed 1) to determine the extent to which opioid markers in mPOA relate to individual differences in GSC and SMC using Western immunoblots and quantitative real time PCR in starlings singing in distinct social contexts; 2) to determine the extent to which opioid markers in mPOA relate to intrinsic reward associated with GSC and SMC using conditioned place preference, a standard measure of reward; 3) to determine the extent to which opioids stimulate GSC and SMC using site-specific opioid pharmacological manipulations in mPOA; 4) to determine the extent to which opioid antagonists disrupt the link between reward and GSC by examining effects of opioid pharmacological manipulations in mPOA on song-associated reward measured using conditioned place preference. Results will elucidate links between opioids, reward, and communication produced within distinct social contexts. The research is innovative and significant because it will provide novel insight into neural mechanisms underlying the motivation to communicate and ways in which distinct reward mechanisms function to shape socially-appropriate behavioral interactions. Findings will reveal mechanisms that facilitate communication in select social contexts."
"9173430","?    DESCRIPTION (provided by applicant): Despite advances in treatment, severe mental illness (SMI) remains common, chronic and difficult to treat. SMI is defined as having at least one mental disorder that lasts for 12-months and leads to substantial life interference. Sleep and circadian dysfunctions are among the most prominent correlates of SMI, yet have been minimally studied in ways that reflect the complexity of the sleep problems experienced by people with SMI. In SMI, sleep and circadian dysfunction undermines affect regulation, cognitive function and physical health, predicts onset and worsening of symptoms and is often chronic even with evidence-based SMI treatment. Prior treatment studies have been disorder-focused-they have treated a specific sleep problem (e.g., insomnia) in a specific diagnostic group (e.g., depression). However, real life sleep and circadian problems are not so neatly categorized, particularly in SMI where features of insomnia overlap with hypersomnia, delayed sleep phase and irregular sleep-wake schedules. Accordingly, we aim to test the hypothesis that a Trans diagnostic Intervention for Sleep and Circadian Dysfunction (TranS-C) will improve functional impairment, disorder- focused symptoms and sleep and circadian functioning. We will recruit participants across DSM diagnoses and across common sleep and circadian problems. The elements of TranS-C are efficacious across SMI in research settings with research-based providers. The next step is to test TranS-C in community settings with community-based providers. Accordingly, we propose to conduct an 'efficacy in the real world' randomized controlled trial within Alameda County Behavioral Health Care Services (ACBHCS), the CMHC for Alameda County. Alameda County is the most ethnically diverse county in the Bay Area. We will recruit 120 adults diagnosed with SMI and sleep and circadian dysfunction within ACBHCS. Individuals will be randomly allocated to TranS-C (n = 60) or 6-months of Usual Care followed by Delayed Treatment with TranS-C (UC- DT; n = 60). TranS-C is modularized and delivered across eight 50-minute, weekly, individual sessions. All participants will be assessed before, immediately following treatment and again 6 months later. Mediation analyses will examine whether improved sleep and circadian rhythm functioning mediate improvements in primary outcomes. Moderation analyses will examine if intervention efficacy is related to previously reported risk factors including demographics, symptom severity, medications, site, and season of treatment as well as psychiatric and medical comorbidity. This application is responsive to NIMH priorities focusing on implementing effective services in the community as well as treatments that are personalized, generalizable and not constrained by diagnostic criteria. RDoC is addressed by recruiting participants across diagnoses and defining sleep and circadian dysfunction broadly. The 'sleep-wake' and 'biological rhythms' constructs from the Arousal and Modulatory Systems domain are intervention targets and outcome measures. Our long-term objective is to establish the potential for widespread dissemination of TranS-C."
"9181405","DESCRIPTION (provided by applicant): High indoor allergen and pollutant levels have repeatedly been linked to asthma morbidity, especially among urban children, who have among the highest asthma morbidity in the US. However, environmental intervention trials for asthma have typically compared an environmental control strategy (ECS) to no intervention, a design that does not reflect the recommended approach to asthma management, which includes ECSs in conjunction with titration of controller medication. As a result, it remains unknown whether the addition of an ECS to controller medication titration results in improved asthma control, and therefore a reduced controller medication requirement. Another unanswered question is whether the addition of an ECS to controller medication titration results in greater reduction of allergic inflammation than medication titration alone. ECSs may have a greater effect on allergic inflammation than controller medications because ECSs target the most upstream point of the asthma inflammatory pathway by reducing pro-inflammatory environmental exposures, while controller medications target a downstream point of this pathway. Surprisingly, it is also unknown whether the improvement in asthma in ECS trials is mediated by reductions in allergen levels and/or reduction in pollutant levels. Understanding the factors that mediate the effects of an ECS on asthma is important for refuting, or supporting, a causal role for indoor allergens and/or pollutants in asthma morbidity, and also for optimizing the design of ECSs to target the most influential factors. We therefore hypothesize that the addition of an individually-tailored, multi-faceted ECS to guidelines-based controller medication titration will result in less controlle medication requirement and allergic inflammation than controller medication titration alone among urban asthmatic children. We will test this hypothesis and identify the factors that mediate the clinical effects of the ECS with a parallel-arm, randomized controlled trial of ECS plus controller medication titration vs. controller medication titration alone. Our aims are: (1) T determine the effect of the addition of ECS to controller medication titration on controller medication requirements and allergic inflammatory biomarkers, and (2) To determine whether reductions in particulate matter (PM) and/or indoor allergens mediate the effects of an ECS on asthma. This proposed trial will answer a pivotal question because if ECSs do not provide additional benefit in the context of treatment with controller medication, the role of ECS in asthma management should be downgraded. On the other hand, if ECSs do indeed reduce controller medication requirements, greater emphasis should be placed on the importance of ECSs in asthma management, studies should be conducted to identify best ECS practices, and policies should be changed to require third party payers to cover ECS costs."
