"APPLICATION_ID","ABSTRACT_TEXT"
"9332057","Project Summary/Abstract Hearing loss is the most prevalent sensory deficit in humans and causes a significant toll on the quality of life of those afflicted. The mammalian cochlea initiates the perception of sound by converting sound waves into electrical signals with exquisite sensitivity, speed and precision. Mechanotransduction in sensory hair cells leads to electrochemical signalsthat induce neurotransmitter release from specialized ribbon synapses, initiating the neural signal for auditory processing. The molecular composition of the auditory processing machinery in hair cells is not well understood, and the nature of how specific molecular interactions lead to physiological events for the processing of sound is unclear. Over 100 nonsyndromic forms of genetic hearing loss have been described but many of the genes linked with these mutations are unknown or not well characterized. Mutations in Catechol-O- methyltransferase 2 (COMT2) cause nonsyndromic recessive deafness (DFNB63) in humans. Our lab generated by ENU-mutagenesis a mouse mutant (termed `Add') in which a point mutation in Comt2, the mouse homolog of the human gene, leads to profound deafness. Comt2 mRNA is expressed by hair cells in the inner ear but the manner in which COMT2 contributes to auditory processing in mice and humans is completely unknown. The objective of this proposal is to investigate the role of COMT2 in the peripheral auditory system and the contribution of COMT2 to auditory processing. The hypothesis is that COMT2 contributes to hair cell function and auditory processing by regulating synapse function in the cochlea. Aim 1 will utilize in situ hybridization, immunohistochemistry and immunogold electron microscopy to precisely characterize the cell-specific and temporal expression patterns of Comt2 mRNA in the mouse inner ear and auditory brainstem and the subcellular localization of COMT2 protein in sensory hair cells. Aim 2 will use CRISPR/Cas9 technologies to generate and validate constitutive Comt2 null mice and floxed Comt2 mice to facilitate studies that will examine loss of Comt2 function on peripheral auditory function and auditory processing. Aim 3 will analyze Comt2 mutants to determine the mechanism by which Comt2 contributes to auditory processing in sensory hair cells. By interrogating Comt2 expression patterns and functions within the auditory system, this work will contribute to a better understanding of mechanisms of auditory processing, physiological roles of COMT2, and etiologies of DFNB63 in humans. "
"9193644","The overall goal of the Administrative core is to ensure the effective and efficient operation of Xenbase - a multi-PI resource with two performance sites. The specific aims of the Admin core are to: Aim 1: To provide the administrative and organizational infrastructure necessary to  implement our multi-PI plan and to maintain effective operations. Aim 2: To promote coordination and communication between the Development and  Curation teams, and to facilitate integration of the different components of the project. Aim 3: To provide mechanisms for oversight and reporting to a) the Xenopus community,  b) the External Advisory Board (EAB) and c) the NIH. Aim 4: To facilitate interactions between the Xenbase leadership and the leadership of  other Model Organism databases (MODs), Stock Centers, and external  resources such as NCBI, UniProtKB and the JGI."
"9182894","DESCRIPTION (provided by applicant):     Project Summary: Eukaryotic cells face constant challenges to the integrity of their genome from both endogenous and environmental sources, and sophisticated processes have evolved to respond to and minimize long-term DNA damage. Cells employ DNA damage tolerance (DDT) pathways to ensure the completion of DNA replication by filling in gaps created by replication barriers or lesions in the DNA. By allowing replication to continue even in the face of minor lesions, DDT pathways prevent replication forks from stalling, which can lead to fork collapse resulting in serious chromosomal abnormalities and genome instability. Nevertheless, at least one arm of the DNA damage tolerance pathway, known as translesion synthesis (TLS), can be mutagenic, the extent to which depends on the lesion and TLS polymerase involved. Thus, considered broadly, DNA damage tolerance pathways help maintain genome stability but can also promote mutagenesis, which can contribute to cancer and drug resistance. The overall goal of this proposal is to understand the molecular mechanisms that govern damage-specific lesion bypass. In the previous funding period, we identified SHPRH and HLTF as multi-functional proteins that contribute to multiple aspects of DDT pathways in mammalian cells. These proteins exert their effects in a damage-specific manner, responding to alkylation damage and UV damage with complementary specificities, yet the mechanisms by which they act remain undefined. In order to understand how SHPRH and HLTF regulate DNA damage tolerance, we will study their regulation and their role in DDT using a combination of genetic and biochemical approaches. The first aim of this proposal will address how HLTF and SHPRH are regulated following DNA damage. We will analyze the interaction of HLTF and SHPRH with damaged replication forks, and determine how different types of DNA damage affect the interaction of HLTF and SHPRH with Rad18, another regulator of DDT. The second aim will address the function and mechanism of action of HLTF and SHPRH in DDT. We will ask how these proteins affect mutagenesis and template switching, the protein composition of stalled forks, and the stability of repeat sequences. Collectively, these studies will provide novel insights into the regulation of two critical regulatory genes that help to minimize mutations arising from replication stress. Both HLTF and SHPRH have been found to be altered in numerous cancers, hence these studies are highly relevant to cancer and other diseases that are modified by genetic mutations."
"9246680","The North Carolina Central University (NCCU) ? Duke Cancer Disparities Translational Research Partnership  (NCCU-DCI CDTRP) is focused on developing infrastructure for translational research and training pertaining  to the increased lethality of specific cancers in African Americans. The Program is built on a long-standing  relationship between two Durham-based Institutions. NCCU is an Institution Serving Underserved health  disparity Populations and underrepresented Students (ISUPS), affiliated with the 17-member University of  North Carolina system, and the Duke Cancer Institute (DCI) is an NCI-designated Comprehensive Cancer  Center. The Partnership will develop around accelerated planning and priority-setting, focused on development  of a bi-directional, mutually beneficial Cancer Research Education Program (CREP) that addresses career  development for graduate students, postdoctoral fellows and early stage investigators. Planning will focus on  establishing regular workshops, seminars, retreats and additional modes of communication and Priority Setting  will focus on developing forward-looking mechanisms for selection of translational research and training  initiatives. The Implementation stage will launch with co-developed, collaborative Pilot Projects selected during  the pre-planning process, which focus on molecular translational aspects of disparities in prostate cancer and  inflammatory breast cancer in African Americans. Nearly 25 Shared Resources between NCCU and Duke will  be available to investigators. Community engagement will mutually co-emanate from NCCU, which directly  serves a minority community, and DCI's Office of Health Equity and Disparities with complementary existing  programming with the underserved minority populations across the region and state. The Partnership will be  led by an integrated Administrative Core (AC) of senior investigators who will serve as mentors to junior  faculty, postdoctoral fellows and graduate students and will include an external Evaluation Program for tracking  impact and outcomes. The Partnership will be guided by an Internal Advisory Committee (IAC), an External  Scientific Advisory Committee (EAC) and a Community Advisory Board (CAB). The objectives of the AC are to  provide for the NCCU-DUKE CDTRP Partnership: 1) Scientific and administrative leadership; 2) Administrative  management and support; 3) Management of committees and implement administrative decisions; 4) Planning  and Evaluation; 5) Access to all DCI and NCCU shared resources; 6) Support career development and  mentorship of investigators; 7) Support for grant submissions. In summary, the AC will promote translational  cancer disparities research at NCCU and DCI through partnerships with such laboratories. Structured  mentoring appointments, seminars and annual steering committee meetings will allow leadership to mentor,  develop and advise productive research activities. The AC will assist in recruiting NCCU and Duke students to  translational cancer disparities research. This Core has defined expectations and metrics to assess progress  and will provide support to allow NCCU and Duke faculty to develop self-supporting research programs."
"9178620","?    DESCRIPTION (provided by applicant): T cell receptor (TCR) ligation induces intracellular signaling cascades including the Ca2+-NFAT (nuclear factor of activated T cells) and MAPK (mitogen-activated protein kinase) pathways that play crucial roles in activation and differentiation of T cells. Defects in these pathways lead to immune deficiency or hypersensitive immune responses in humans and mice. The small GTPases, Ras, Rac and Rho are known to play a central role in activation of TCR signaling pathways and are therapeutic targets in autoimmune diseases. These small GTPases are recruited into the immunological synapse (IS), the interface between an antigen-presenting cell and a T cell via interactions with signaling adaptors and activate the downstream MAPK pathway. However, in contrast to Ras, Rac and Rho GTPases, little is known about the role of more than 60 members of the Rab GTPase family in T cell activation. Our long-term goal is to uncover the role of Rab GTPases in TCR signaling to identify novel therapeutic targets to alleviate autoimmunity. We have recently identified a novel Rab GTPase, CRACR2A GTPase that plays a key role in TCR signaling. Our preliminary data show that CRACR2A GTPase is a lymphocyte-specific large Rab GTPase with many functional domains in contrast to small GTPases. We found that CRACR2A GTPase translocates into the IS to activate the downstream JNK (c- Jun N-terminal kinase) MAPK pathway. Furthermore, it is highly expressed in TH1 cells and plays an important role in expression of IFN-? and T-bet, and thus in autoimmunity. Our central hypothesis is that CRACR2A GTPase is recruited into the IS via protein interactions and regulates the JNK pathway to drive TH1 differentiation. The objective of this proposal is to identify 1) interacting partners, 2) GTP binding and prenylation-mediated regulation, and 3) the physiological role of CRACR2A GTPase in T cells using high resolution imaging techniques, genomics and conditionally targeted knockout mice. CRACR2A GTPase is the first example of a large molecule containing the small Rab GTPase domain. We expect to reveal a hitherto unknown mechanism of regulation of the JNK pathway in T cell differentiation. We are confident that we will also identify a unique signaling function of Rab GTPases, which are otherwise known to mediate only intracellular protein trafficking. These mechanistic studies will have significant impact on therapeutic exploitation of this novel GTPase to treat autoimmune diseases."
"9325817","Adolescence is the period in which individuals are most likely to initiate the consumption of drugs of abuse. The onset of drug use during adolescence, however, also confers the highest risk of progressing from recreational use to addiction. This suggests that drug exposure during the critical window of adolescence may interfere with ongoing neuronal development and cause behavioral changes which facilitate subsequent substance abuse and addiction. However, there is still a significant lack of knowledge about the mechanisms accounting for these age-dependent effects of drug exposure. To address this gap in our knowledge, it is important to understand (1) the mechanism underlying the interaction between drugs of abuse and the adolescent brain, (2) how these interactions disrupt the development of neuronal circuitry, and (3) the resulting long-lasting changes in addiction-relevant behaviors. The guidance cue receptor DCC has recently emerged as a key molecular player in the adolescent organization of the mesocorticolimbic dopamine system, and expression of DCC is regulated by adolescent exposure to drugs of abuse. Exposure to the stimulant drug of abuse, amphetamine, during early adolescence disrupts the development of dopamine input to the medial prefrontal cortex of mice via alterations to DCC signaling. The long-term goal of the studies proposed here is to determine if amphetamine in adolescence reroutes dopamine axons to the medial prefrontal cortex from limbic regions by disrupting DCC-mediated guidance events, and identify the enduring consequences on prefrontal cortex-dependent cognitive behavior. These neurobiological and behavioral alterations may underlie heightened vulnerability to progress to addiction in individuals that initiate drug use in adolescence. The experiments will employ neuroanatomical, gene transfection, and behavioral techniques in a mouse model to assess three specific aims. Aim 1 will determine whether amphetamine in adolescence increases prefrontal cortex dopamine innervation by promoting the rerouting of mesolimbic dopamine axons during adolescence. Aim 2 will assess whether DCC signaling is the molecular mechanism by which amphetamine in adolescence reroutes mesolimbic dopamine axons to the prefrontal cortex. Aim 3 will determine the role of DCC in mediating the long-term behavioral consequences of adolescent mesocorticolimbic dopamine reorganization. The results of the proposed research will move the field toward a clearer understanding of the mechanisms accounting for the age-dependent effects of drug exposure on addiction vulnerability. These results could be used to facilitate development of individualized prevention and treatment strategies aimed at adolescent drug users, who are at heightened risk to progress to addiction."
"9182819","DESCRIPTION (provided by applicant): Translesion synthesis (TLS) DNA polymerases (Pols) promote replication through DNA lesions which block the continued progression of the replication fork. Although structural studies with the various yeast and human TLS Pols have indicated that they could function in TLS in highly specialized ways, the information available for their biological roles has been relatively meager; in particular, the biological role of Pol? has remained the least understood. In the proposed studies, we will use a combined genetic, biochemical, and structural approach to test the hypothesis that Pol? makes an important contribution to promoting replication through DNA lesions which impair Watson-Crick (W-C) base pairing or which protrude into the DNA minor groove. Furthermore, and most importantly, studies will be done to test the hypothesis that Pol? functions opposite DNA lesions in a much more error-free manner than opposite undamaged residues. In Aim 1, we will examine the roles of Pol? and other TLS Pols in human cells in promoting replication through N1-methyl adenine (1-MeA), which impairs W-C base pairing; a deaza derivative of N3-methyl adenine (3-dMeA), which protrudes into the DNA minor groove; and an N2-dG adduct of 1,3-butadiene (N2-dG, R-butadiene monoepoxide), which like 3-dMeA, is a minor groove lesion but chemically more complex. 1-MeA and 3-dMeA are generated from exposure to environmental alkylating agents and from endogenous cellular reactions, and 1,3-butadiene is an important industrial chemical and an environmental pollutant. For TLS analysis in human cells, we will utilize two different duplex plasmid systems, an SV40 origin-based plasmid and an EBV origin-based plasmid, and the relative contributions of Pol? and of other Pols to lesion bypass and to mutagenicity will be determined. In Aim 2, biochemical studies will be done to examine the proficiency of Pol? and of other Pols in synthesizing DNA opposite the 1-MeA, 3-dMeA, and N2-dG R-butadiene monoepoxide adducts. By steady-state kinetic analyses, we will determine the catalytic efficiency and fidelity of Pol? and of other Pols for inserting a nucleotide (nt) opposite each of these lesions and for extending from the inserted nt. In Aim 3, structures of Pol? in ternary complex with the 1-MeA, 3-dMeA, N2-dG R-butadiene monoepoxide, and also a (6-4) TT photoproduct will be determined to uncover the bases of Pol? ability to function opposite these DNA lesions in a predominantly error-free manner. Biochemical studies, and TLS studies in human cells, will be carried out to examine the effects of mutations in residues that help stabilize the correct incoming nt opposite the lesion site. The proposed studies are highly relevant for cancer biology and cancer etiology as they will reveal whether Pol?, in conjunction with other TLS Pols, promotes a predominantly error-free mode of TLS opposite a diverse array of DNA adducts. An error-free mode of TLS would be in keeping with a role for Pol? in suppression of carcinogenesis that would otherwise result from exposure to environmental and chemical carcinogens."
"9192327","Project Summary  Despite progress in the field of human-machine interfaces to control assistive devices for individuals with tetraplegia, the learning burden to efficiently operate these devices rests largely upon their users. The objective of this proposal is to lessen this burden by leveraging principles of optimal control that govern unimpaired movement. Specifically, manipulating feedback noise may be an effective means of shaping and enhancing control of redundant degrees of freedom and may improve human-machine interface performance of individuals with tetraplegia. This work uses a kinematic human-machine interface that translates high dimensional body movements to low dimensional control commands. Clinical impact of the proposed work will be directly measured by conducting extensive assessments of individuals with tetraplegia performing functional tasks, controlling a computer cursor and driving a power wheelchair. The results of these studies are intended to inform training paradigms for a wide family of human-machine interfaces that exploit the availability to the disabled users of control signals in excess of the number of variables that are required to control an assistive device. If successful, this work will directly result in enhanced training paradigms for reorganizing human dexterity and adapting it to the constraints established by the disability. This will increase the number of individuals who will be able access assistive devices, increasing functional independence and broadly improving quality of life."
"9124576","?     DESCRIPTION (provided by applicant): Arsenic is a naturally occurring toxic metalloid element to which prolonged exposure in humans is associated with keratosis, hyperpigmentation, lung and cardiovascular disease, and multiple forms of cancer. Chronically exposed individuals show high variability in symptoms, even among similarly exposed individuals. Host specific factors like genetic variability, body weight, and diet only partially account for this observed variability. In ecosystems where it occurs naturally, arsenic can exist in a variety of organic and inorganic chemical compounds of varying degrees of toxicity. In these environments, biochemical transformations of arsenic are primarily driven by microbial processes. Some microbes also have the ability to incorporate arsenic into their cellular biomass.  The gastrointestinal tract (GIT) microbiome of mammals confers numerous important functional benefits to the host organism, many of which are not well understood or characterized. It has also been shown that altering gut microbial communities of mice can change the profile of arsenic transformations that take place in these communities. Preliminary research suggests that the GIT microbiome functions to protect the murine host from ingested arsenic. We have demonstrated that germ-free mice and mice with antibiotic-disrupted GIT microbiomes accumulate more arsenic in host tissues when compared with similarly exposed mice with conventional microbiomes. When the primary host system for detoxifying systemic arsenic is inactivated, mortality is observed in germ-free and antibiotic treated mice, even at low  levels of arsenic exposure.  The proposed research aims to investigate the function of the human microbiome in arsenic toxicity by leveraging the use of germ-free mice, which can be colonized with the GIT microbiome from a human donor. This research will investigate not only the influence of the human microbiome on host arsenic exposure, but also the mechanisms by which it influences. Arsenic transformations will be measured in germ-free and humanized mice while tracking host health to determine the health impacts of specific transformations in vivo. In order to determine if specific microbial groups increase or decrease the host's exposure to toxic arsenicals, the microbiome of humanized mice will be manipulated while monitoring arsenic transformations and host health. This research will elucidate new functions of the human microbiome relating to arsenic toxicity. There is potential for this project to have immediate impacts on human health interventions."
"9274822","DESCRIPTION (provided by applicant):         Objectives. Co-occurrence of alcohol use disorder (AD) and posttraumatic stress disorder (PTSD) is common. Research supports exposure therapy as the front line treatment for PTSD as this approach is most likely to lead to sustained recovery from the disorder. However, individuals with AD are generally not offered exposure therapies because of beliefs that exposure would lead to engagement in greater alcohol use and other dangerous behaviors. Most research and clinical treatment for AD/PTSD have involved coping skills based therapies that have generally not shown sustained reductions in alcohol use and PTSD symptoms. A growing body of evidence suggests these individuals with AD/PTSD are able to handle and benefit from exposure. This proposed trial will compare an integrated exposure psychotherapy to an integrated coping skills psychotherapy for the treatment of AD/PTSD. In addition, mechanisms of change for Veterans with AD/PTSD in both treatment conditions, including therapy process variables, changes in negative affect, and sleep problems, will be explored. Significance: This project addresses a critical barrier in the field - the widely held belief that individuals with AD and PTSD cannot tolerate exposure therapy, although it is the best practice treatment for PTSD. If completed, this project will help change the practices that drive treatment for this highly prevalent and highly distressed population. The fundamental rationale is to improve the evidence base that informs how patients with AD/PTSD can attain sustained recovery. Innovation: This application seeks to shift current clinical practice paradigms. A refinement to existing interventions is proposed through integration of two evidence based treatments. The simplicity of the exposure therapy protocol makes it amenable to dissemination and modification to AD treatment settings. Methodology. We propose a randomized controlled trial to evaluate an integrated exposure-based treatment (Integrated Prolonged Exposure; I-PE) for concurrent AD and PTSD that is evidence based and includes both in-vivo exposure and trauma processing. The primary aim will be to conduct a randomized controlled trial to evaluate the effects of I-PE when compared to a present-focused coping skills based intervention (Seeking Safety) in 148 male and female Veterans who have AD and PTSD. The hypotheses are that at post-treatment both groups will show reductions in alcohol use, but I-PE will demonstrate greater reductions in PTSD symptoms than SS. At 5- and 8- month post-baseline follow-up, I-PE will have significantly fewer percent drinking days and fewer PTSD symptoms than SS. In addition, mechanisms of change in both treatment conditions will be examined."
