"APPLICATION_ID","ABSTRACT_TEXT"
"9244182","Project Summary Using mobile technology that most students already have in their pockets, we propose a novel use of SMS text messages to change campus drinking norms. We aim to correct exaggerated perceptions of drinking norms, and thereby reduce excessive drinking, by delivering push notifications representing accurate, campus-specific, pro-moderation descriptive norms (what others do) and injunctive norms (what others approve of). We predict that with repeated exposure over time, this information will compete with other sources of normative information to which students are exposed during their first year of college. In this exploratory R21, we will develop and refine message content and pilot test the delivery methods. First, with input from student advisors, we will survey a representative sample of 300 students about personal behaviors and attitudes, and perceived descriptive and injunctive norms, for a wide range of alcohol-related behaviors and protective strategies. Extending the range of behaviors previously studied in the norms literature, these data will yield campus-specific norms and identify items with the largest self-other discrepancies as potential sources of corrective feedback. Second, we will translate the content into a pool of text messages and solicit feedback, iteratively, from approximately 40 first-year students. Third, we will conduct a pilot test of the SMS-delivered pro-moderation norms intervention to evaluate the effect of receiving these text messages on perceived peer norms, and high volume drinking and consequences. First year students (N=120) who are underage but report risky drinking (>4/day or >14/week for men; >3/day or >7/week for women) will be randomly assigned to two conditions differing by text content: alcohol norms or control. All will receive 5-6 text messages per week over 12 weeks. Process measures, 3-month post-test, and 3-month follow-up assessments will yield feasibility, acceptability, and preliminary outcome data to inform future larger scale randomized trials. We predict that the experimental condition will be acceptable and interesting, will protect against increases in pro-drinking perceived norms, and will result in less risky drinking and fewer alcohol consequences, relative to control. This project has public health significance because high volume drinking has harmful consequences to self and others, and has proven to be hard to change on college campuses; individual-level interventions typically have limited reach, and environmental policy changes can be hard to implement. This mHealth intervention offers a novel approach to prevention during a period of transition, and this study will provide proof-of-concept that SMS text messages can be used over time to correct exaggerated alcohol norms, a mechanism known to reduce excessive drinking and its negative consequences."
"9191359","DESCRIPTION (provided by applicant): In spite of decades of basic and clincial research, breast cancer remains the second leading cause of cancer death and the most commonly diagnosed cancer in American women . A major breakthrough for prevention and cure has been the appreciation that breast cancer is not one disease, rather a collection of cancer subtypes becoming better defined by improved methodologies based upon histopathologic, genetic and molecular signatures. Over time we have applied histological type, grade, tumor size, lymph-node involvement, and estrogen receptor (ER) and HER-2/neu receptor status to help define prognosis and probability of response to therapies, yet these alone have not fully captured the varied behavior of breast cancer. The field is now rapidly progressing with gene expression and proteomic signatures that will help personalize our interventions for individuals. This same concept is relevant to interventions for primary or secondary prevention and is the focus of our translational grant application. Our pre-clinical studies have demonstrated a strong benefit for dietary ?-3 fatty acid rich fish oil for the inhibition of ERPR(-)HER-2/neu(+) mammary tumors in a transgenic mouse model showing decreased tumor incidence, multiplicity and glandular atypia. Thus, our central hypothesis is that the development of aggressive breast cancer sub-types such as of ERPR(-)HER-2/neu(+) or ERPR(-)HER-2/neu(-) (i.e. triple negative) disease may be uniquely responsive to eicosapentaenoic acid (EPA) and docosahexaenoic acid (DHA), the long chain ?-3 polyunsaturated fatty acids (PUFAs) found in fish oil. As a first step towards a future definitive prevention trial in women, we propose to test the efficacy of an ?-3 rich fish il supplement to modulate breast biomarkers indicative of anti-carcinogenic action. We will randomize high risk survivors to a placebo-low dose or high dose ?-3 rich fish oil capsule treatment and employ our breast fine needle aspiration techniques to obtain cells and tissue for analysis of biomarkers of exposure and efficacy. Our multidisciplinary team has developed the following Specific Aims to: (1) Determine the effects of dietary ?-3 fatty acids on biomarkers of exposure and response in women at high risk for recurrent estrogen receptor, progesterone receptor breast cancer +/- HER-2/neu overexpression; and (2) Define the role of dietary ?-3 PUFAs in the epigenetic regulation of the inflammatory responses underlying mammary carcinogenesis as a novel mechanism for the effects of ?-3 PUFAs. Development of these biomarkers of ?-3 PUFA exposure and response will enable the assessment of this bioactive food component in future large-scale prevention trials for women at risk for recurrence of ERPR(-)HER-2/neu(+) or triple negative breast cancer."
"9193636","?    DESCRIPTION (provided by applicant):  The inflammatory bowel diseases (IBD) affect over a million people in North America. Many patients with IBD do not respond initially or lose response to even our most effective therapies (anti-TNF antibodies). Thus, there is an unmet need for novel therapeutics. Blocking leukocyte traffic is a proven therapeutic option in IBD. This pathway might be targeted by monoclonal antibodies, such as natalizumab/vedolizumab or alternatively by orally administered small molecules, such as sphingosine-1-phosphate (S1P) receptor. Indeed, a drug that interacts specifically with S1P receptor-1 (S1P1) (i.e. RPC1063) has entered the clinical trial stage in IBD, while another is already FDA-approved for multiple sclerosis (i.e. FTY720). However, a critical need remains to understand the mechanism/s through which these drugs modulate chronic inflammatory diseases. Our long- term goal is to understand how to manipulate the S1P pathway for therapeutic purposes in IBD. Our immediate objective is to understand the mechanism of action of novel S1P1-selective agonists with proven efficacy in preclinical therapeutic studies. Based on the predominant expression of S1P1 on lymphocytes and endothelial cells, we hypothesize that S1P1-selective agonists act both on leukocytes, (by promoting T cell egress, Aim 1) and/or on endothelial cells (by modulating endothelial function, Aim 2). This hypothesis stems from our preliminary data that demonstrates that chronic inflammation alters S1P synthesis and degradation (promoting T cell retention) in IBD mouse models and human IBD and that S1P1-selective agonism degrades S1P1, increases recirculation of effector T cells and ameliorates inflammation in clinically-relevant IBD mouse models. Our innovative approach takes advantage of 1. Chronic mouse models of IBD that recapitulate many of the characteristics of the human disease, 2. New drugs with distinct downstream actions and 3. Cutting edge microscopic techniques that allow us to directly visualize the effects of these drugs on a living animal. Our inter-institutional studies bring together our extensive expertise in lymphocyte traffic/IBD models at UCSD with that of The Scripps Research Institute: S1P pharmacology/endothelial cell biology, which allows us to consolidate valuable infrastructural and mouse model resources. Our rationale is that understanding the mechanism of action of these novel anti-inflammatories will lead to optimized drug design and minimize the risks related to the pleiotropic effects of non-selective S1P receptor agonists (e.g. FTY720) on cellular processes. The proposed research is significant as this pathway is evolutionarily conserved in mice and humans. Therefore, our results might directly translate to human IBD, enabling us to elucidate the mechanism of action of S1P1-selective agents. Furthermore, we may uncover new targets for therapeutic intervention within the S1P pathway (kinases, lyase) to be modulated pharmacologically with oral drugs, at reduced cost of production and administration, compared with current antibody-based biologic strategies."
"9198780","?    DESCRIPTION (provided by applicant): The interplay of transcription regulation and chromatin organization is essential for normal tissue development and function, and maintenance of cellular differentiation. Loss of the normal differentiated state is a hallmark of many malignancies. A better understanding of all the mechanisms that regulate and maintain the differentiation state of a tissue will enable the development of strategies to maintain, enhance and induce differentiation to improve cancer outcomes and functional-differentiation-dependent outcomes such as milk production in the mammary gland. Transcription factors binding to regulatory elements and regulating chromatin states whilst enabling transcription initiation of target genes is one of the main processes underlying differentiation- dependent (tissue- and developmental stage specific) gene transcription. Recent genome wide studies have indicated that developmental gene expression is also regulated through transcription elongation control following promoter-proximal pausing. However, there are still gaps in our understanding of which cell-specific transcription factors interact with the elongation complex to regulate cell differentiation and function in vivo. We have shown that Singleminded-2s (Sim2s; expressed from Sim2), a member of the bHLH/PAS family of transcription factors, plays a major role in expression of differentiation-associated genes in the mammary gland, not as a classical DNA-binding transcription factor, but by interacting directly with the transcriptional elongation complex. Based on these exciting new results, we hypothesize that a subset of differentiation- dependent genes are regulated through enhancement of elongation in conjunction with changes in chromatin organization, mediated in the mammary gland by Sim2s. To address this hypothesis we propose two Specific Aims. In Aim 1, we will couple Global Run On (GRO)-seq with RNA-seq and ChIP-seq analysis for Sim2s binding and histone modifications associated with active gene expression during mammary gland development using WT and Sim2 mammary gland knockout and over-expressing mice. In Aim 2, we will define the physical basis for, and functional outcomes of interactions between Sim2s and P-TEFb components involved in transcription factor recruitment, elongation control and chromatin alterations associated with time- dependent hormone-dependent activation of the Csn2 gene. In addition, we will also determine the effect of over and under expression of elongation factors on hormone-induced Csn2 expression in WT and Sim2s over and under-expressing HC11 cells. These studies will better define mechanisms by which differentiation is regulated through selective gene expression and give new insight into the regulation of differentiation- dependent gene transcription in the mammary gland and functionally differentiated tissues in general."
"9240765","After more than 30 years of using ?-lactamase inhibitors (BLIs) in the treatment of patients, pressing questions still remain at the forefront of our clinical efforts. Although, the value of ?-lactam/BLI combinations (e.g., piperacillin/tazobactam) was well-established by the 1990s, the rapid emergence of ?-lactamases that hydrolyzed expanded spectrum cephalosporins, carbapenems and were resistant to inactivation by BLIs created a global crisis in antimicrobial chemotherapy and propelled the quest for a novel class of inhibitors, the diazabicyclooctanes (DBOs). In addition to the extended spectrum ?-lactamases (ESBLs), the major challenges to overcome in Klebsiella pneumoniae are the serine carbapenemases (e.g., KPC-2, OXA-48) and the metallo- ?-lactamases (MBLs) (e.g., NDM-1, VIM and IMP). Fortunately, avibactam (AVI), a DBO BLI, inactivates KPC-2 and OXA-48; the efficacy of AVI against MBLs is absent.  Our investigations in the previous grant cycle awarded us with unprecedented and frightening insights. We were painfully reminded that we cannot anticipate ?-lactamase evolution; the diversity in amino acid sequences that nature can yield and their impact on catalytic activity and resistance are unpredictable. We found to our dismay that KPC-2 ?-lactamase variants expressed in Escherichia coli DH10B with the amino acid substitutions, S130G, K234R, and R220M conferred resistance to ampicillin-AVI. Moreover, we discovered that a single amino acid substitution in VIM-24 (R228L) confers enhanced resistance to ceftazidime and cefepime. We came to the inevitable conclusion that: i) resistance to AVI was present before this BLI was released; and ii) MBLs can expand their substrate profile and enhance cephalosporin resistance much like the class A and C extended-spectrum ?-lactamases (ESBLs). In this Merit application, our goals are to: 1) continue to probe the structural and mechanistic basis for resistance to AVI in KPC; 2) learn how novel substrate specificity evolves in KPC and NDM carbapenemases. We will apply for the first time complementary structural methods (x-ray crystallography, NMR, and Double Electron Electron Resonance, DEER) to help us understand how structure activity relationship are defined in carbapenemases with the intent that these new insights will lead to new approaches in BLI design. In addition, recent computational analyses of KPC-2 ?-lactamase molecular dynamics predict that ?hydrophobic networks? contribute to the structural integrity and allosteric signaling of KPC-2 and other class A ?-lactamases. This novel insight defines our third goal: 3) if these hydrophobic networks contribute to allosteric signaling, can allosteric inhibitors offer new opportunities for BLI design. The unrelenting pace of resistance makes it imperative that we understand fundamental biochemical interactions in order to find BLIs that act by novel mechanisms.  Our multidisciplinary approach to studying carbapenemases will allow us to anticipate how new mutations will effect BLI and cephem catalysis and anticipate novel resistance phenotypes. We also propose that we will discover important conformational changes upon AVI binding and uncover networks that may be involved in allosteric signaling. If this is confirmed, disruption of these ?hydrophobic networks? will open an alternative approach to overcoming resistance and lead to new BLIs."
"9187817","?    DESCRIPTION (provided by applicant): This proposal seeks support jointly for the 2016 Photosensory Receptors & Signal Transduction Gordon Research Conference (GRC) and associated Gordon Research Seminar (GRS), to be held January in 23-29, 2016 at Hotel Galvez in Galveston, Texas and in the spring of 2018, most likely in April at the GRC site Renaissance Tuscany Il Ciocco Resort, Lucca, Italy. This biennial meeting is one of the most prestigious forums for participants to discuss topics at the frontiers of photobiological and biomedical research. Since it began 15 years ago, this GRC series has regularly brought together leading researchers and developing scientists from across the world. About half of the participants will be from the USA and half from Europe, Asia, Oceania and South America, reflecting the active international community in this scientific area. The 2016 and 2018 conferences will continue to provide a unique platform to unite researchers from a diverse range of subfields and disciplines to discuss and share new results and emerging approaches on natural and synthetic photosensory systems. Although photobiology largely originated in the plant sciences and is still strongly represented there, it now embraces a multitude of other experimental organisms such as bacteria, fungi and mammals. Researchers working on fundamental aspects of hot sensory biology will be united with those focused on developing new technologies in the applied field known as optogenetics. This fast-moving field spans the range from molecular to clinical, with practitioners developing methodologies aimed at directing gene expression, modifying the transmission of nerve impulses and restoring vision. A key to extending such tools is harnessing the diversity of photoreceptor systems that are available in nature. The continued efforts of this GRC/GRS series will ensure that the breadth of these disciplinary interactions is maintained and further developed through vigorous discussion and collaboration. Other unique features of this conference include: a 2:1 (talk versus discussion) time for oral presentations; the sheltered meeting venues where participants dine and socialize together outside of the sessions, afternoon social activities planned to promote networking, and poster displays accessible throughout the day and following evening sessions to maximize exposure, as well as space reserved within the main GRC program for short oral presentations to promote talented graduate students, postdoctoral fellows, and junior faculty poster presentations. The closely associated GRS will also allow students and postdoctoral researchers to bring forth their latest developments in the field, lay the scientific groundwork in areas these junior scientists may be less familiar with, and offer explicit mentoring led by senior scientists in informal, round-table discussions aimed at broad aspects of career development. In each case, the breadth of topics and the diversity of techniques employed in this highly multidisciplinary field will attract a diverse group of scientists with a common interest in photosensory function and application."
"9225290","We have identified a spontaneous mouse mutant (now maintained on an A/J inbred strain) that develops eosinophilic vasculitis in multiple organs. As disease progresses, the heart develops eosinophilic myocarditis, extensive fibrosis and right ventricular dilated cardiomyopathy, with mutant mice dying of heart failure (HF) by 14 weeks old. These pathologies overlap those for patients diagnosed with eosinophilic granulomatosis and polyangiitis, EGPA (also known as Churg-Strauss Syndrome). EGPA is a rare vasculitis affecting small- to medium-sized vessels, typically associated with asthma, peripheral and tissue eosinophilia, upper respiratory symptoms, and clinical signs of systemic vasculitis. Cardiac involvement is well-known, with prevalence ~60%. In fact, heart disease is linked with poor prognosis, accounting for ~50% of EGPA-related deaths. Delayed diagnosis can lead to rapid health decline, but patients identified early in the disease respond well to steroids and immunosuppressant drugs. Consequently, knowledge gained from this mouse mutant line has potential not only to improve quality of life for these patients, but to radically impact morbidity and mortality. The etiology of EGPA is unknown, but is expected to involve many genes. Besides preliminary work on the pathology of this mutant, we sought to map chromosome regions for genes linked to EGPA/HF. HF seen in maintenance lines of the mutant was consistent with 2 genes segregating for the trait. But results of our initial mapping attempts with C57BL/6J mice indicated one or more additional genes were segregating. To explain a disparity in the number of genes involved, we posited that a de novo mutation in an immunoregulatory gene, together with existing A/J- variants, leads to disease. Two aims are proposed: 1) Critically assess the mutant mouse line to establish as a valid model of EGPA/HF. We will characterize the line to differentiate features of EGPA from those for the hypereosinophilic syndromes or two similar vasculitides with overlapping clinical characteristics. And, since EGPA is highly associated with allergic asthma, we will further test the hypothesis that allergen inhalation can trigger disease development. 2) Map the EGPA/HF trait in this mutant line; identify and begin to evaluate top candidate genes. A backcross breeding strategy was selected over F2 crosses to increase the rate of affected mice, and DBA and SJL strains will be used to test a role for natural A/J mutations in hemolytic complement (C5) and/or dysferlin (Dysf) in EGPA, respectively. The proposed backcross strategy will markedly increase the rate of affected mice generated for mapping. We expect 3-4 dozen affected recombinants from different strain? pair combinations will allow us to map the key loci to high resolution and, with available exome and RNA-Seq data already in hand, to quickly find excellent candidate genes. When validated as a model for EGPA, this mutant will provide an invaluable research tool to understand the molecular and pathogenic mechanisms of eosinophil-related vasculitis and its related organ damage. And, as the genes for this complex disease are not known, this mutant also affords a unique opportunity to delineate the multi-gene interactions causing EGPA."
"9197320","DESCRIPTION (provided by applicant):  The epidemic of toxicity related to prescription opioid use among U.S. adults is thought to be related to drug abuse. Thus, the public health response has focused on programs to reduce non-medical uses. However, little attention has been given to the possibility of a parallel epidemic among children, particularly vulnerable to opioid toxicit. Preliminary Tennessee Medicaid data suggest this epidemic now possibly affects children: the proportion of children 2-17 years old prescribed opioid analgesics increased from 5% in 1996 to 11% in 2007, with a comparable trend in medical care possibly consistent with opioid toxicity. What is the appropriate public health response to this potential threat to the safety of children? Because children's prescriptions must be filled by a parent or guardian, non-medical use is less plausible, particularly for young children. For this reason, pediatric opioid toxicity is most likey to be an unintended consequence of therapeutic use, which would need to be considered as part of prescription risk-benefit evaluation. Thus, there is an urgent need to quantify the incidence of opioid toxicity in children to inform pediatric practitioners' decision-making. Furthermore, opioid prescribing practices associated with elevated risk need to be identified so these can be avoided when possible. Potentially hazardous practices include higher doses, high-potency opioids such as oxycodone, and concurrent central nervous system depressants. To address this unmet public health need, we will conduct a large retrospective cohort study in an estimated 500,000 Tennessee Medicaid children 2-17 years of age with 1,000,000 filled opioid prescriptions and 1400 confirmed cases of opioid toxicity. There are two specific aims: Aim 1. Quantify the incidence of toxicity related to prescription opioid use according to a) the child's age, b) toxicity severity, and c) whether or not the toxicity was related to therapeutic use. Aim 2 Test the hypothesis that opioid toxicity risk increases with: a) increased opioid dose, b) high-potency opioids, and c) concurrent use of other CNS-depressant drugs. These data on the risks of opioid medications increasingly used by children will provide a sound basis for altering pediatric practice to address a novel threat to the safety of this vulnerable population."
