"APPLICATION_ID","ABSTRACT_TEXT"
"9206525","?    DESCRIPTION (provided by applicant):   There is a shortage of biostatisticians. The goal of this proposal is to develop a training program to remedy this shortage by introducing undergraduate students to biostatistics. A diverse group of undergraduates committed to quantitative training will be recruited into the introductory program. This introduction will inclue instruction on the basics of biostatistics, epidemiology, genetics and statistical computing. In addition to instruction in this basic material, trainees will be exposed to how biostatisticians collaborate with other researchers as members of research teams working on exciting problems in pulmonary and cardiovascular health. Trainees will also have an opportunity to hear about interesting methodological problems that arise in the course of conducing collaborative research by participating in seminars with cutting edge methodologists. To help ensure that trainees are knowledgeable about the specific requirements for graduate work in biostatistics, multiple training sessions will provide career counseling and practical advice on how to prepare to be a competitive applicant for biostatistics graduate programs. To best achieve these goals, the training program will engage in self-evaluations guided by solicited feedback from trainees. These evaluations will include reflections on the extent to which the pool of trainees reflects current demographic realities. These objectives will be fulfilled by using a group of faculty known for their excellent teaching and mentoring. The faculty assembled for this proposal includes award winning teachers whose careers are focused on developing techniques for facilitating instruction in biostatistics and world class researchers who can share fascinating stories from decades of interdisciplinary research. A detailed curriculum has been developed that includes instructional lectures, seminars presenting research findings from a variety of studies and active learning computer laboratory sessions where trainees will gain instruction in the use of SAS and R. Many of the planned training activities utilize innovative approaches to ensure that trainees get hands on experience designing an experiment (through protocol development), collecting and analyzing data (using a virtual population), and presenting the findings. These training activities will be complemented by field trips where trainees will have the opportunity to see how biostatisticians contribute to research teams in a variety of settings and recreational activities that will provide a fun break from the rigors of the training schedule. The shortage of well-traine biostatisticians has been identified as a major impediment to the success of research aimed at improving public health. The factors contributing to this lack of expertise are varied but include  lack of visibility of the profession and a perception that biostatisticians are not potential scienific leaders. This training program is designed to not only increase the visibility of biostatistics, bu through careful selection of seminars and field trips, to demonstrate to trainees that biostatisticians can contribute at the highest level to the advancement of science."
"9241626","Ectopic Lipids in the Pancreatic Alpha Cells Link Insulin Resistance to Hyperglycemia  Just as insulin insufficiency can lead to elevated glucagon secretion, preliminary data suggest that impaired insulin action within the ?-cell can also promote hyperglucagonemia, hyperglycemia, aberrant gluconeogenesis, and excess glucose efflux from the liver. Pancreatic perfusion with anti-insulin serum causes marked hyperglucagonemia, and ablation of insulin receptor from ?-cells prompts fed hyperglucagonemia and glucose intolerance. Sphingolipids, such as ceramides and glucosylceramides, are an important class of bioactive lipids which may impair insulin signal transduction in the ?-cell. Most recently, it has been demonstrated that ceramide is sufficient to impair insulin-induced suppression of glucagon from ?-cells. The levels of these lipids change as a function of adipose tissue mass and functionality, and are partially driven by cellular availability of palmitoyl-CoA. Aberrant accumulation of sphingolipids has been implicated in a multitude of metabolic processes, including atherosclerosis, insulin resistance, lipotoxic heart failure, ?-cell apoptosis and ?-cell dysfunction. The adipose-derived secretory factor adiponectin promotes an increase in ceramide catabolism, which is dependent on adiponectin receptors 1 and 2 (AdipoR1/R2). The associated ceramidase activity promotes ceramide degradation and correlates with the suppression of hepatic glucose efflux. Fibroblast growth factor 21 (FGF21, a reported glucagon suppressor), rapidly stimulates adiponectin secretion and improves glycemia by harnessing adiponectin?s ceramide-lowering potential. Preliminary results suggest that novel small molecule mimetics of adiponectin (currently in pharmaceutical development) may offer the same potential therapeutic benefits of adiponectin to improve glucose homeostasis by decreasing ceramide excess and glucagon secretion.  We hypothesize that: 1) Preventing ceramide excess within ?-cells enhances suppression of glucagon by 3 of its endogenous attenuating signals (insulin, leptin, and GABA-all repress glucagon via Akt/FoxO1) A portion of adiponectin?s glucose-lowering effects are mediated by inhibiting glucagon secretion which is directly triggered by adiponectin receptor-driven lowering of sphingolipids in ?-cells; 3) The glucagon-suppressive effects of FGF21 are mediated by ceramide-lowering within the ?-cell in an adiponectin-dependent manner; and 4) Limiting glucagon secretion or glucagon receptor activation improves insulin signal transduction by preventing glucagon-induced activation of PP2A. In essence, we believe that the insulin-desensitizing effects heavily studied in muscle, liver and adipose can also occur in the ?-cell, triggering hyperglucagonemia, hyperglycemia, and metabolic sequelae of diabetes. As such, many potential therapeutic agents currently under development (including FGF21 analogs, adiponectin mimetics, and ceramide synthesis inhibitors) may function as glucagon suppressors via sphingolipid-mediated actions and may require glucagon-suppressive actions in order to achieve full anti-diabetic efficacy. Newly-available imaging mass spectrometry techniques make these studies feasible for the first time."
"9203067","?    DESCRIPTION (provided by applicant): This proposal describes a 31/2 year training program for developing a career focused on mechanisms regulating postnatal distal lung morphogenesis. I completed a residency in pediatrics at the University of Colorado Health Sciences Center and a fellowship in pediatric critical care medicine at the University of Alabama at Birmingham. Since accepting a position at Cincinnati Children's Hospital, I have risen from Instructor to Assistant Professor, and I have developed a nascent research program defining the mechanisms of stretch- regulated matrix remodeling in lung development and regeneration. Dr. Jeffrey Whitsett, an accomplished neonatologist and developmental biologist, has a track record of mentoring over 30 successful physician- scientists and has served as my mentor since my arrival. He along with an established scholarship oversight committee will advise me in my transition to a successful, independent research career with R01 funding. The proposed research focuses on the role of stretch-regulated matrix remodeling in septation. Although lung stretch and matrix remodeling are critical factors impacting distal lung morphogenesis, we do not understand how these processes are coordinated or how they regulate alveolar septation. During development and compensatory lung growth stretch induces lung elastin remodeling and regulates fibroblast expression of chymotrypsin-like elastase 1 (Cela1). Cela1 binding to lung matrix increase exponentially with strain, and Cela1 is largely bound to Serpina3 in the extracellular matrix. This proposal tests the overall hypothesis that stretch-regulation of Cela1 activity is critical to alvelar septation. Aim 1 of this proposal tests whether Serpina3 is the putative inhibitor of Cela1 in the lung matrix by pull-down and mutation of the Serpina3 reactive center loop. To define the stretch-dependent mechanism by which Cela1 binds lung tropoelastin, Aim 2 measures the extent to which specific tropoelastin peptides quench the binding of Cela1 to lung matrix with increasing strain. It then tests the critical Cela1 amino acids mediating this interaction by site directed mutagenesis. Aim 3 first defines the lung phenotype of the Cela1 knockout mouse and quantifies Cela1's contribution to lung elastase activity. Subsequently, it tests the importance of Cela1 in the physiologic matrix remodeling of regeneration and the pathologic matrix remodeling of emphysema. The career development portion of this proposal is foundational for my transition to research independence. It provides training in bio-mechanical model generation and testing. When combined with dynamic imaging of ex vivo lung sections and methods for quantifying different cellular and matrix-remodeling processes, this knowledge will permit mechanistic insight into how stretch and strain regulate distal lung morphogenesis. On a molecular level, this proposal also will provide training in molecular model generation and the methods testing these models. This training and the associated collaborative relationships will be key in developing a multidisciplinary, transformative research program focused on improving lung health in children with BPD."
"9233082","The overall objective of the Viral Vector and Transgenic Mouse Core is to provide Diabetes Research Center affiliate investigators at the University of Washington with state-of-the-art vectors necessary to overexpress, knockdown, knockout, or otherwise alter expression of RNAs and proteins of interest in cultured cells, isolated tissues, and animals. The Core has considerably evolved since the last competitive renewal. New services to generate genetically engineered mice have been added, and under-utilized and standard molecular biology methods that are now increasingly performed in individual investigator's labs have been removed. The specific aims of the Core are to provide the following services to affiliate investigators: (1) Production of lentiviral, adenoviral and retroviral vectors for use in animals, tissues, and cells; (2) Production of vectors for generation of transgenic, knockout, and knockin mice; (3) Specialized molecular biology methods not routinely performed in affiliate investigators' laboratories; (4) Cost-effective production of genetically engineered mice through the University of Washington Transgenic Resources Program; and (5) Consultation and training.. The Core has been highly productive in the current funding period and has added new services that are expected to significantly increase productivity and usability for Diabetes Research Center affiliate investigators to meet the Center's goal to enhance research in diabetes, obesity and related disorders in the Greater Seattle area and beyond."
"9233087","Thie Quantitative and Functional Proteomics Core ofthe University of Washington Diabetes Research  Center provides affiliate investigators the powerful tools of modern mass spectrometry and complex data set  analysis. The goals of the Core are to: (1) Perform mass spectrometric (MS) analyses such as quantifying  target analytes and obtaining spectra for structural identification of proteins. Technologies include  electrospray ionization tandem mass spectrometry (ESI-MS/MS), matrix-assisted laser desorption ionization  (MALDI) time-of-flight (TOF) MS, and TOF/TOF MS/MS; (2) Provide and maintain functional MS systems; (3)  Develop new MS methods for structural identification or quantification of biomolecules involved in the  pathogenesis of diabetes and its complications, risk factors, or treatment; (4) Provide a central facility for  data storage, dissemination, and sharing; (5) Provide training in principles of MS and using MS systems,  including gas chromatography (GC-MS), ESI-MS/MS, and MALDI-TOF-MS/MS analysis; (6) Reduce the cost  of research by providing a centralized MS/informatics facility at a fraction of the cost of maintaining  instruments and computational support in individual investigators' laboratories or of using commercial MS  facilities; (7) Provide bioinformatic support for analyzing and interpreting proteomic data sets and for  integrating them with Gene Ontology, protein-protein interaction databases, and pathway analysis; and (8)  To integrate proteomic studies with functional studies, with the long-term aim of providing an integrated,  systems biology view of diabetes and diabetes-related disease processes. By providing a centralized facility,  the Core meets these goals with optimal efficiency and cost-effectiveness, avoiding the need for individuals  to maintain the required instrumentation in their own laboratories or use expensive commercial mass  spectrometric services. Further, by centralizing and standardizing procedures, the Quantitative and  Functional Proteomics Core provides its affiliate investigators a common set of analytical tools for obtaining a  unified understanding of molecular mechanisms involved in pathophysiologic processes of diabetes and its  associated complications."
"9273249","SUMMARY Pursuant to the Specific Aims (SA) of the OVERALL section for the Hub, the ADMINISTRATION CORE focuses on the OVERALL SA1, i.e., the overall objective of the proposed Hub to establish a source of expertise to elucidate the etiology of the empirical overlap between severe LD and juvenile delinquency. More specifically, to implement a number of activities, as outlined in the ADMINISTRATION CORE, that will (1) crystallize the relevant expertise on the overlap between severe LD and juvenile delinquency, establishing a network of scientists and practitioners relevant to these issues; (2) provide career opportunities for early stage investigators (ESIs) and early career researchers (ECRs); and (3) identify potential translational applications for Hub findings. To realize this objective, a particular structure of the ADMINISTRATION CORE is proposed, including an Advisory Board, Stakeholders, Mentors, and a PI. Numerous activities are proposed to (1) achieve the overall objective; (2) support the realization of the RESEARCH PROJECT; and (3) enhance the developmental trajectories of ESIs and ECRs."
"9198885","DESCRIPTION (provided by applicant): Despite many years of discussion, research, and efforts to promote change, a great disparity remains between the presence of black, Hispanic, Native American, and other underrepresented minority (URM) faculty at US research universities and their representation in the American population. This reality is no less true in te neurosciences than in other disciplines. Moreover, URMs who do achieve faculty status appear to achieve traditional measures of success at a lower rate than do their majority counterparts. Although data on publications and funding rates appear to be lacking, there is a striking absence of URMs in visible positions of prominence as full professors or chairs at research universities and as symposia speakers, journal editors, or societal officers. We believe that these two problems are related - that if those URMs who are faculty become more successful in regard to those measures, this in turn will stimulate an influx of other URMs into faculty ranks. Our evaluation of available programs in the United States strongly indicates that there are limited opportunities to adequately assist early career URM faculty in overcoming these difficulties, and it is this problem that we seek to address through the establishment of a nationa Early Career Institute (ECI) to promote the advancement of junior faculty members in the neurosciences at research universities. Defining success for such faculty in terms of quality and quantity of manuscripts published and research grant proposals submitted, scored, and funded, we propose to establish an ECI based on the following hypothesis: The success of early career URM faculty members in neuroscience can be increased substantially by an intensive individualized educational program focused on (1) exposure to cutting edge research in basic neuroscience, (2) increased background on the neurobiology of disease, (3) instruction in professional skills and the responsible conduct of research (RCR), (4) development of an expanded network, and (5) frequent mentoring by established faculty. To test this hypothesis we wish to establish a national Early Career Institute (ECI) to advance the development of URM faculty. We will begin by identifying 10 URM faculty members in the neuroscience each year who are early in their career and have great promise for success. We will then develop individualized career development programs for each participant selected and together the participant and mentoring team will develop a career development plan. To facilitate that plan we will establish a one- year educational program consisting of (a) workshops, (b) mentored attendance at professional scientific meetings, (c) assistance in the expansion of their network, and (d) a listserv to promote communication among the participants. The impact of our efforts will be carefully evaluated and the results disseminated at meetings and in published articles. We believe that this approach will have a significant impact on the success of early career URM faculty in the neurosciences and will also serve as a model for programs in many other areas of academia."
"9198996","?    DESCRIPTION (provided by applicant): Diabetes is a chronic and complex metabolic disease. Chronic high glucose exposure produces impaired angiogenesis/lymphangiogenesis during wound healing resulting in skin ulcerations of the lower extremities (leading cause of non-traumatic lower limb amputation) and making diabetes a leading cause of morbidity and mortality. Vascular endothelial growth factor receptors (VEGFR2/3) are critical regulators of angiogenesis and lymphangiogenesis. Importantly, VEGFR2/3 is significantly reduced in the vascular endothelium of diabetic patients. However, the mechanisms responsible for the VEGFR2/3 loss remain poorly understood. Prolonged high glucose exposure reportedly induces ligand-independent degradation of Golgi-localized VEGFR2; however the degradative pathway has not been defined. Intriguingly, we unveil that diabetic conditions elevate autophagosome components, Ulk1 and LC3B and induce VEGFR2/3 targeting to autophagosomes. Given that VEGFR2/3 depletion drives impaired diabetic wound healing, whether autophagosomes mediate degradation of Golgi-localized VEGFR2 is a highly significant and open question. Our latest data show that epsins, endocytic adaptor proteins critical for ligand-induced VEGFR2/3 internalization and degradation in physiologic conditions, are upregulated and interact with Ulk1/LC3B and VEGFR2/3 in autophagosomes in diabetes. Epsin deficiency inhibits diabetes-induced loss of cell surface VEGFR2/3 independent of VEGF. Thus, we hypothesize that epsins promote the degradation of cell surface VEGFR2/3 by targeting VEGFR2/3 to autophagosomes, and autophagic degradation downregulates both new synthesized Golgi-localized and cell surface VEGFR2/3 to effectively decrease VEGFR2/3 levels in diabetic endothelium. Lastly, we hypothesize that disrupting epsins and Ulk1 to protect VEGFR2/3 from diabetic-induced autophagic degradation may offer a new therapeutic strategy to combat retarded diabetic wound healing. In Aim 1, we will determine mechanisms underlying diabetes-induced degradation of intracellular VEGFR2/3. The proposed studies will identify novel mechanisms by which LC3B and Ulk1 mediate degradation of Golgi-localized VEGFR2/3 in the diabetic endothelium. In Aim 2, we will determine mechanisms of diabetes-induced cell surface VEGFR2/3 autophagic degradation. These studies will provide novel information on how epsins and Ulk1/LC3B cooperatively regulate ligand-independent cell surface VEGFR2/3 degradation. In Aim 3, we will examine the therapeutic potential of epsins and Ulk1 null animals in diabetic angiogenesis using in vitro angiogenesis assays and in vivo diabetic wound healing and Matrigel plug assays in our novel db/db and Akita diabetic mouse models with combinatorial conditional depletion of endothelial epsins and Ulk1. These studies will shed light upon the beneficial effects of epsins and Ulk1 loss in diabetes, and test the combinatory therapeutic potential of epsin and Ulk1 inhibition in the treatment of defective diabetic peripheral angiogenesis."
"9231898","LMAN1 mutations in colorectal cancer development Abstract  Every year over 50,000 people die of colorectal cancer, making it the third most common cause of cancer death in the United States. Identification and functional characterization of new pathways associated with oncogenes and tumor suppressor genes are important in understanding the disease mechanism and the development of targeted treatment approaches. A recent report identified frequent biallelic mutations that result in the loss of LMAN1 expression in microsatellite unstable (MSI-H) adenomas and carcinomas, suggesting that LMAN1 mutations occur early in tumor development and are positively selected in MSI-H colorectal tumors. Our group has shown that LMAN1 is a mannose-binding lectin that functions as a cargo receptor for the transport of glycoproteins from the endoplasmic reticulum (ER) to the Golgi. To determine whether LMAN1 mutations contribute to tumor development, we tested LMAN1 expression in human microsatellite stable (MSS) colorectal cancer tissues, and found complete or partial loss of LMAN1 expression in 40% of them. Using mouse models and colorectal cancer cell lines that are deficient in LMAN1 expression, we have obtained strong preliminary data suggesting that LMAN1 functions as a novel suppressor of colorectal cancer. Initial studies of 65 MSS colorectal cancer patients revealed that those lacking LMAN1 expression had significantly worse prognosis than those with normal LMAN1 expression. The specific aims of this proposal are: 1) to elucidate the molecular mechanism by which LMAN1 deficiency contributes to formation and development of colorectal cancers; 2) to identify the underlying mechanisms for the loss of LMAN1 expression in human MSS colorectal cancer tissues. This study will uncover previously unknown links between protein secretory deficiency and carcinogenesis in the colorectal cancer suppression by LMAN1. Results may lead to effective personalized medical care for a subset of patients whose cancer is deficient in LMAN1. Knowledge gained from these studies may be applicable to other types of cancer."
"9242514","DESCRIPTION (provided by applicant):  Prior studies suggest that women with intellectual and developmental disabilities and their infants are at elevated risk of having adverse obstetric health outcomes. Yet, there is no research on pregnancy or infant health outcomes with a population-based sample of US women with intellectual and developmental disabilities or their infants. As a result, many questions remain unanswered about the unmet perinatal health care needs and health outcomes of women with intellectual and developmental disabilities. In the proposed study, we plan to address this gap in the literature and use our findings to develop perinatal care recommendations to improve care for women with intellectual and developmental disabilities. The specific aims of this study are to (1) Investigate pregnancy and childbirth complications, outcomes, and inpatient costs among women with intellectual and developmental disabilities and women in the general US obstetric population, (2) Examine longitudinal health outcomes and health care utilization and costs of women with intellectual and developmental disabilities around the time of their pregnancy and for their infants (up to 1 year of age) compared to other women, and (3) Identify unmet needs and barriers to perinatal care for women with intellectual and developmental disabilities through in-person interviews with pregnant women and new mothers with IDD and telephone interviews with the health care professionals who provide their health care. The study will be conducted using nationally-representative population-based data from the Healthcare Cost and Utilization Project (HCUP) and the Massachusetts Pregnancy to Early Life Longitudinal-All Payer Claims Database (PELL-APCD) linked data system to determine differences in perinatal health care utilization, outcomes, and costs between women with and without intellectual and developmental disabilities and their infants. Finally, the study will develop perinatal care recommendations, providing clinicians with practical tools to address the unique needs of this highly vulnerable population of women with IDD."
