"APPLICATION_ID","ABSTRACT_TEXT"
"9210533","?     DESCRIPTION (provided by applicant):          Alcohol abuse by current military personnel and Veterans is a significant health concern. Enlisted personnel returning from deployment are often young enough that brain maturation and refinement processes are still ongoing. Given the escalation of drinking and stress-related risk factors in this population, it is crucial to understand how alcohol affects the brain during this tme period and later on in life. To investigate the neurobiological processes that are affected by alcohol abuse during this critical period of brain development, we replicate the blood alcohol levels seen in humans during alcohol binges by use of a chronic intermittent ethanol (CIE) paradigm. Our lab has previously shown that rats exposed to this ethanol paradigm during late stage brain development undergo changes in brain physiology that manifest as impaired learning and memory even into adulthood. Until recently, the field has primarily focused on alcohol's specific effects on neurons and neuronal signaling. Here, we instead propose to elucidate the contributions of the non-neuronal glial cells, including astrocytes and microglia, as  a novel approach to understand the cellular mechanisms that underlie synaptic dysfunction resulting from repeated ethanol exposure. Astrocytes, in particular, play a critical role in synaps formation, neuronal maintenance, and synaptic repair after injury through the release of astrocyte- secreted factors. However, when astrocyte signaling goes awry, the resulting stress placed on neurons contributes to the pathology of disease states, such as epilepsy and neuropathic pain. Using our CIE paradigm in rats, we now have evidence that some of these astrocyte-signaling factors and their receptors involved in synapse formation are chronically upregulated in the hippocampus brain region into adulthood, well after the acute effects of alcohol exposure have subsided. This upregulation corresponds with disruptions in hippocampal synaptic structure and function, highlighted by selective deficits in a spatial memory task. These results suggest that the upregulation in astrocyte-secreted factors may contribute to the observed structural and functional neuronal changes observed after CIE, leading us to hypothesize that changes in astrocyte function during CIE contribute to these observed synaptic deficits. Intriguingly, pharmacologically inhibiting the interaction between one of these secreted factors and its neuronal receptor during the acute response to CIE prevented the upregulation of this receptor at later time points, strengthening our hypothesis that changes in astrocyte function  during CIE are driving the protracted synaptic deficits. Astrocytes and microglia have also been known to initiate and respond to inflammatory signaling cascades induced by excessive alcohol exposure, but here we propose to investigate whether the inflammation is linked to the upregulation of glial signaling factors and the disruption of synaptic structure and function observed after CIE. In summary, this proposed work uses a novel cellular approach to unravel the mechanisms of brain injury and dysfunction that occur after alcohol abuse, implicating astrocytes as potential targets for innovative therapeutic strategies in line with the VA mission."
"9394504","?    DESCRIPTION (provided by applicant): The goal of this project is to develop innovative statistical methods for causal inference in observational studies that can handle time-varying confounders, censoring by death, and missing data in addition to selection bias, and to answer important clinical questions on management of the Amyotrophic Lateral Sclerosis (ALS) disease. The existing studies on addressing these questions have several limitations including their small to moderate sample sizes and the use of limited clinical data and statistical methods that did not adequately address complicating issues including selection bias commonly encountered in observational studies. This study will use the data from the Emory ALS Registry with several notable strengths including a large sample size of over 1,700 patients with long-term follow-ups and collection of extensive clinical information at each clinic visit since 1997. A a result, the Emory ALS Registry is uniquely suited for answering important clinical questions. The analysis of the ALS Registry presents several challenges including time-varying confounders, censoring by death, and missing data. The existing statistical methods cannot be applied directly to address all these issues. These considerations lead to three specific aims: 1) develop a new propensity score for balancing time-varying covariates in observational studies, the propensity process, and develop statistical methods for estimating causal effects based on the propensity process; 2) develop statistical methods for assessing the survivor average causal effects (SACE) in the presence of missing data in observational studies with time-varying covariates; and 3) perform systematic evaluation of the proposed methods in Aims 1 and 2 through extensive simulations and perform analysis of the Emory ALS Registry data. Progress in all aims will be guided by and evaluated on the Emory ALS Registry, and by extensive simulation studies. The proposed methods will enable us to answer important clinical questions, e.g., assessing the effects of procedures including the percutaneous endoscopic gastrostomy (PEG) and the non-invasive positive pressure ventilation (NIPPV) on patient outcomes. The proposed methods are general and promise similar benefits to a wide range of observational studies and registries, since similar data structures and analytical issues are often encountered in these types of studies."
"9198252","DESCRIPTION (provided by applicant): Cardiovascular disease (CVD) is the leading cause of death in the U.S. Despite the availability of evidence-based guidelines and efficacious therapies, however, many patients do not achieve the full benefit of CVD risk reduction. In particular, complex patients (defined as those patients who do not respond to current disease management approaches) with multiple concurrent chronic conditions represent a key segment of the population that would benefit from new approaches to care. In response to PA-12-024: Behavioral Interventions to Address Multiple Chronic Conditions in Primary Care, which seeks practical interventions...to modify behaviors using a common approach among patients with multiple co-morbidities, we propose to implement and rigorously evaluate an integrated behavioral intervention designed to improve a core set of chronic disease self-management skills and to overcome common barriers to care engagement encountered by this increasingly important segment of the U.S. adult primary care population. This randomized trial will be conducted within Kaiser Permanente Northern California (KPNC), an integrated care delivery system serving over 3.2 million members, including patients insured through Medicare and state Medicaid programs. We will evaluate our intervention in 3 KPNC primary care practices by enrolling 576 complex patients who have persistently (e 2 years) uncontrolled CVD risk factors (e.g. hypertension, hyperlipidemia, diabetes) despite being enrolled in a CVD disease management program. This behavioral intervention is designed to activate and engage patients, identify potentially hidden barriers to care such as alcohol misuse or sub-clinical depression, and to develop individualized care plans that are designed to catalyze more effective primary care management. Randomization will be at the patient-level, blocked by primary care provider, with the following aims: 1) To examine the impact of (intervention + usual care) vs. (usual care alone) on control of systolic blood pressure [primary outcome], LDL cholesterol, Framingham Risk Score (if no baseline CVD), and HbA1c (if with diabetes) at 12 months; 2) To examine effectiveness of (intervention + usual care) vs. (usual care alone) on proximal outcomes (patient activation, medication adherence, and mental health status) after 3 and 12 months, and 3) To identify baseline patient factors associated with more vs. less successful clinical response among intervention arm patients. By focusing on core health skills and care barriers, this patient-focused intervention seeks to enable complex patients to become more effective agents of their own care and to thereby achieve similar clinical benefits as less complex patients."
"9238065","Project Summary/Abstract  Research indicates that pediatric obesity prevalence is high among all children, but that children from rural areas are disproportionately affected. There are very few interventions specifically targeting pediatric obesity treatment among rural children, a factor that contributes to this health disparity. Previous research from our lab indicates that mHealth is feasible and acceptable for the delivery of pediatric obesity interventions to rural children as this type of intervention lowers child Body Mass Index z score (BMIz) and helps children and families to significantly change their health behaviors. The current application extends this work in a new and innovative direction by moving the mHealth intervention into rural family homes, increasing convenience and dose simultaneously. The intervention is composed of both group and individual family level components, based upon new research that indicates this combination is highly effective. Finally, the composition of the intervention groups is also innovative as they will be composed of children from the same school, making individual level factors as well as factors clustered at the school level addressable in one intervention. The current study proposes to compare the effectiveness of two active interventions: iAmHealthy vs. control (a newsletter control group) using in cluster-randomized design. iAmHealthy is a 32 week behavioral intervention focused on nutrition, behavior and physical activity that engages parents and children in treatment using mHealth technology. It combines family based behavioral groups with individual level child and family support ? all provided directly to homes via mHealth technologies. Children and families meeting inclusion criteria from a total of 18 schools will be randomly assigned by school to condition, with at least 8 families participating at each rural school, for a total of 144 child and 144 adult participants. We hypothesize that: the iAmHealthy intervention will result in significantly greater improvement in food choices than the active control intervention (as indicated by servings of sugar sweetened beverages, number of servings of ?red foods,? and number of servings of fruits and vegetables); the iAmHealthy intervention will result in significantly greater improvement in levels of physical activity than the control intervention (as indicated by change in number of minutes of moderate/vigorous physical activity); and, that the iAmHealthy intervention will result in significantly greater improvement in child BMIz and parent BMI than the control intervention. Aim 2 uses the RE-AIM framework to measure the effectiveness of iAmHealthy. iAmHealthy is an easily scalable, widely disseminable pediatric obesity intervention option for rural children and families, if found to be effective; the results of the current study could significantly alter the way we treat pediatric obesity among high risk and underserved rural children."
"9238196","Project Summary The goal of the proposed research is to understand the immunologic mechanisms by which specific major histocompatibility complex (MHC) class II molecules provide resistance to develop autoimmune type 1 diabetes (T1D) by evaluating insulin specific T cell responses, particularly focused on insulin B chain amino acids 9-23 (B:9-23). For many autoimmune disorders, including T1D, specific human leukocyte antigen (HLA) alleles confer disease risk as HLA-DQ8 and/or DQ2 are present in approximately 90% of all T1D patients. Strikingly, the polymorphic HLA-DQ6 (DQB*06:02) allele provides dominant protection from T1D. The objective of the proposed studies is to bridge the gap of knowledge regarding MHC class II disease resistance and self- antigen T cell response in T1D. Our long-term goal is to understand how insulin specific T cell responses can be manipulated for preventative and therapeutic purposes, ideally using mutated insulin B:9-23 as antigen specific therapy. The central hypothesis is that the MHC class II genotype shapes autoimmunity to insulin B:9- 23, determining susceptibility or protection from T1D. We plan to test our hypothesis using mutated insulin B:9- 23 peptides to determine T cell phenotypes in the context of MHC class II genotypes in murine and human diabetes. In specific aim 1, we will utilize a spontaneous mouse model of autoimmune diabetes including a model with a single amino acid mutation in the MHC class II beta chain (?57Ser?Asp) implicated in diabetes resistance. Insulin B:9-23 specific T cells restricted to risk and protective MHC class II molecules will be tracked using fluorescent tetramers. Experiments will be done to test the hypothesis that a protective MHC class II molecule leads to the generation of B:9-23 regulatory T cells (Tregs) that suppress islet autoimmunity; either through converting a pathogenic T cell to become regulatory and/or by differentiating B:9-23 specific Tregs restricted to the protective MHC class II molecule. In the second aim, we will study insulin and insulin B:9-23 specific T cell responses from well-characterized human subjects at risk for developing T1D and subjects without islet autoantibodies in a prospective longitudinal study. We now have the ability to measure both inflammatory and regulatory T cell responses to insulin with mutated B:9-23 peptides from the peripheral blood, which will allow for an increased understanding of disease pathogenesis in preclinical T1D. Further, healthy controls having the protective DQB*06:02 allele will be studied to isolate, characterize and T cell receptor (TCR) sequence B:9-23-specific Tregs, thereby creating reagents to assess the structural interactions of a diabetes resistant trimolecular complex, TCR-B:9-23-DQ6. A B:9-23/DQ6 tetramer will be produced to stain and phenotype ex vivo T cells from DQ6 individuals. The findings from this research are directly applicable to the design of insulin antigen specific therapies, monitoring and timing in the preclinical T1D period to prevent disease onset."
"9196373","DESCRIPTION (provided by applicant): Over 17 million Americans have sleep apnea and have persistent hypersomnolence. Chronic sleep disruption (CSD) is implicated in residual sleepiness in sleep apnea; yet the mechanisms by which CSD impairs wakefulness are not known. Wakefulness is modulated, in part, by collections of neurons throughout the brain that are activated in wakefulness and quiescent in sleep. We propose that CSD-induced repeated excitation of wake-activated neurons (WAN) across sleep stresses WAN metabolics, and that WAN injury and dysfunction contribute to wake impairments in sleep apnea. Utilizing a mouse model of CSD, we confirmed that CSD impairs wakefulness and arousal responses, and we have discovered that CSD markedly reduces neuronal excitability in locus coeruleus neurons, a representative group of WAN. Mitochondrial sirtuin type 3 (SirT3) plays several crucial roles in protecting metabolic homeostasis. In preliminary studies, we find that CSD imparts oxidative and inflammatory stress on WAN and that SirT3 is progressively lost from WAN across CSD. Loss of SirT3 induces wake impairments and WAN injury. We hypothesize that CSD reductions in SirT3 and augmentations in a pro-inflammatory response determine both WAN injury and lasting wake impairments. The goals of this proposal are to determine the relevance of WAN SirT3 loss in CSD WAN dysfunction and WAN degeneration and to identify the within WAN crosstalk between the CSD inflammatory response. Elucidation of neuronal mitochondrial metabolic dyshomeostasis as an important contributor to impaired wakefulness and WAN degeneration from CSD will extend our fundamental model of sleep/wake control under conditions of CSD and will enable development of molecular targets to improve wakefulness in many sleep disorders, including OSA."
"9242303","The Veterans Healthcare Administration (VHA) treats more than 26,000 individuals with HIV infection, making it the largest provider of care to HIV-infected individuals in the U.S. Neurological complications occur commonly in HIV infection, with over 40% of individuals being at risk for developing HIV-related neurocognitive impairment (NCI). Therefore, it is likely that a large number of Veterans experience symptoms related to NCI, which overall responds poorly to treatment with antiretroviral drugs. Factors that underlie the development of NCI include neuronal dysfunction due to enhanced production of proinflammatory cytokines (e.g., TNF-? and IL-1?) and other inflammatory mediators that are secreted by HIV-infected cells in the brain.  Astrocytes make up the largest percentage of cells in the brain and, when infected by HIV-1, secrete proinflammatory factors that can potentially have significant detrimental effects on the brain. In this proposal we will examine the potential effects of nicotinamide adenine dinucleotide (NAD) metabolism and activation of the glycohydrolase CD38, the energy sensing molecule 5' AMP-activated protein kinase (AMPK), peroxisome proliferator-activated receptor gamma coactivator 1-? (PGC1?) and the sirtuin SIRT1 in suppressing nervous system inflammation and other neuropathological abnormalities mediated by infection and activation of astrocytes. For these studies we will utilize two transgenic rat models of HIV-1 infection. One is a well- established model, developed on a wild-type F344 Fischer rat background (the HIV1Tg rat) and the other, developed more recently, is on a on a nude Fisher rat background (the HIV1TgNu+ rat); which provides a model of HIV infection in the presence of severe immunodeficiency.  The studies proposed in this Merit will be performed utilizing F344 and F344 nude (F344Nu+) rat primary astrocytes transfected with a plasmid containing an insert that is identical to transgene that is present in the transgenic rats as well as primary cells from the rats. Studies will be also performed in vivo using the animals. The cells and animals will be treated with activators and inhibitors of NAD, CD38, AMPK and SIRT1 to determine the effects of the agents on inflammatory response and neuropathological abnormalities that can occur. We anticipate that information obtained utilizing these innovative models and approaches will lead to the development of more effective treatments for HIV-related NCI in humans."
"9242270","Vascular dementia (VaD) is often caused by small vessel arteriosclerotic disease, resulting in ischemic damage to white matter and associated neurodegeneration. Autopsy studies indicate that such changes contribute to the roughly one-third of dementia cases attributed to mixed pathology (MxD), with features of both Alzheimer's disease (AD) and VaD. MxD is particularly prevalent among older Veterans, who have increased risk factors such as metabolic syndrome and cardiovascular disease. However, current clinical trials with AD therapeutics frequently exclude patients with MxD. The interactions of vascular and AD pathology remain elusive, in part due to the dearth of animal models that recapitulate MxD symptomology and pathology. Our project addresses this hurdle, establishing a novel rat model of MxD to elucidate mechanisms associated with vascular complications in AD. We examine the impact of promising therapeutics to prevent AD in the MxD model, focusing on amyloid vaccines, to facilitate the development of combination therapies that can minimize adverse effects of vaccine in MxD patients, such as vasogenic edema and microbleeds. Although asymptomatic in patients with pure AD, the impact on AD patients with VaD is unknown. This proposal will assess: a) if VaD exacerbates AD-associated A? and/or tau pathology; b) differences in peripheral and central inflammation in VaD, AD, and MxD relative to cognitive and/or neurodegenerative parameters; c) whether plasma endothelial microparticles differentiate VaD, AD, and MxD; and d) the effects of known modifiers of AD pathology on MxD. This proposal uses an APP/PS1 transgenic rat model of AD, which develops age-related cognitive deficits, A?/tau deposition, and gliosis. In Aim 1, we examine the impact of this FAD transgene in spontaneously hypertensive stroke-prone (SHR-SP) rats, which exhibits age-related vascular and white matter pathology, neuron loss and progressive cognitive deficits. This MxD model (SHR-FAD) is compared with FAD positive controls and nonTg rats [SHR-SP versus the control strain WKY] for differences in cognition; peripheral and central inflammation, vascular and parenchymal A?, and synaptic loss; and other AD- and VaD- associated pathologies. Plasma and CSF biomarkers corresponding to specific disease pathologies will be identified. Aim 2 investigates interventions that promote amyloid clearance: passive immunization with an anti- A? antibody and curcumin, a pleiotropic A?-binding molecule, to determine their effects on vascular A? deposition and cerebrovascular disease in the SHR-FAD model of MxD. We hypothesize that VaD exacerbates neuroinflammation, synaptic loss and tau accumulation, but reduces neuritic plaques, increasing cerebrovascular amyloid deposition. Increased cerebral penetration of the peripheral anti-A? antibodies and increased plasma levels of cerebrovascular microparticles and cellular adhesion molecules may parallel disruption of the blood brain barrier. Completion of these aims is likely to provide knowledge important for AD trials in patients who also have VaD."
"9238815","PROJECT SUMMARY/ABSTRACT Most cancers of the head and neck are squamous cell carcinomas (HNSCC) and the majority affects the oral cavity or pharynx. Tobacco use and alcohol consumption are the major risk factors and together account for approximately two-thirds of the cases. Oral infection with human papillomavirus (HPV) is an important independent risk factor for the development of oropharyngeal cancer (OPC); only 6% of other HNSCC sites are associated with HPV. Incidence of HPV-related OPC is increasing, most notably in the U.S. and Europe. Interestingly, and likely due to differences in etiology and related differences in tumor characteristics, HPV- positive [HPV(+)] tumors have a more favorable outcome than HPV-negative [HPV(-)] tumors. A recent large genome-wide association (GWA) study from this group identified multiple novel susceptibility loci for HNSCC, and in particular a strong role for the human leukocyte antigen (HLA) region in OPC. Further, recently completed tumor genome profiling efforts have provided important information on the somatic alterations present in HNSCC. However, only limited numbers of HPV(+) tumors were included and these studies have offered little insights into the clinical relevance of the identified alterations due to the limited nature of clinical and outcome data available. To improve understanding of the genetic factors involved in oral cancer (OC) and OPC risk and outcome, we will utilize samples and data from 5 well-annotated study populations to: (Aim 1) complete HPV analysis of 2,028 OPC cases in order to evaluate the relationship between germline variants, and in particular variants in the HLA region, and risk of HPV(+) OPC; (Aim 2) perform whole exome and targeted sequencing on 2,000 representative tumors (1,000 OCs, 1,000 OPCs) to further elucidate the driver mutations and potential therapeutic targets in OC and OPC, and to clarify potential mechanisms associated with lifestyle and infectious exposures for developing both cancers; and (Aim 3) utilize available outcome data on these 2,000 patients to evaluate the role of somatic alterations in OC and OPC in outcome, build prediction models for OC and OPC survival, and clarify the role of smoking in HPV(+) OPC outcome."
