"APPLICATION_ID","ABSTRACT_TEXT"
"9379565","The Morehouse School of Medicine G12 Multidisciplinary Biomedical Research Center (G12/MBRC) research goal is to build a critical level of biomedical research capability, productivity, and training that will allow MSM to pursue multidisciplinary approaches to discovery science that translate into the amelioration of health disparities. MSM has experienced growth and success of its research enterprise over the past decade based on a strategic plan that focuses our talent and resources in discrete areas. The G12/MBRC proposal builds on this foundation developed with careful stewardship and investments of RCMI resources. Our approach is to enhance the research capacity in biomedical science by building effective inter- and intra-institutional partnerships synergizing/leveraging the collective strengths of our faculty, trainees, students and collaborators. The G12/MBRC institution-wide framework and key activities are designed to promote transformative changes in our research environment enhancing our research capacity in biomedical research, ultimatelly enhancing our clinical/translational science through the following specific aims: Aim I: Transform Our Institution: Provide an organizational framework; Support a culture of collaboration between institutional units and between institutions; rework the TTP financial framework to enhance research development in multidisciplinary biomedical and translational science. Aim II: Transform Our Research Environment: Provide a robust research infrastructure/training environment fostering innovative, multidisciplinary biomedical/translational research. Aim III: Transform the Community of Biomedical Scientists: Provide an institution-wide resource that: (i) leverages existing training programs and integrates research project support and mentorship enhancinig research training/career development; (ii) incentivizes collaborative, multidisciplinary research; (iii) synergizes research support and core technology mentorship to enhance research training/career development and expand the intellectual property portfolio at MSM. Overall, the implementation of these specific aims will enable MSM to fulfill its long term goal of translating discovery science into community-based solutions that ameliorate health disparities."
"9281276","The Administrative Leadership Core    The Administrative Leadership Core (ALC) of this application has been designated to assume the leadership in developing an adequate research environment to conduct the Universidad Central del Caribe to a more productive scientific enterprise. This setting encompasses a Leadership Core with experienced administrators and staff in research management, a Scientific Research Development Unit to foster research faculty development in basic and clinical investigation, and a Data Management and Statistical Research Support unit as a complementary specialized service to the research efforts by the faculty. The ALC will act as the flagship of the overall proposed plan and will be accountable for its execution. The research plan that this administrative component proposes to oversee, contemplates to strengthen the Retrovirus Research Center by providing expert personnel and the HIV and Substance of Abuse Laboratory Core; to strengthen the Neuroscience Research Center, which will nurture an intellectually stimulating environment (mentoring, collaborations, exchange program, a Behavioral Testing Facility and a Neuronal and Glial Culture Facility) for neuroscience research, and create a Cancer Research Center, which will have a cluster of investigators studying dietary compounds as potential cancer preventive and therapeutic agents. In addition, the ALC will continue supporting essential research cores (Optical Imagine, Protein and Nucleic Acid Core Facilities and Common Instrumentation Area and Services); and create a Biomedical Proteomics Facility. Furthermore, the ALC will provide support to five pilot projects in the areas of retrovirology, neuroscience and cancer and implement an RCMI evaluation plan to appraise accomplishments. The judicious Implementation of this plan is considered pivotal to consolidate UCC's past, present and future research efforts."
"9193648","Summary: Xenbase is a very complex computing environment consisting of multiple separate databases, many different software applications, the user and curator web interfaces and many automated data exchange pipelines - all of which are integrated by a middle layer of complex custom code. Keeping all of these systems working seamlessly and efficiently requires constant monitoring, testing, maintenance, bug fixing and upgrading. Each time new software is implemented it must be extensively tested and optimized so that it is properly integrated with existing systems. The goal of the Computing Component is keep Xenbase operational, reliable, and responsive, to maintain and upgrade the hardware, infrastructure, software and systems necessary for peak performance and to support the proposed improvements described in other sections of this application."
"9177744","?    DESCRIPTION (provided by applicant): Most retroviral infections result in indefinite viral persistence with an undetectable or inefficient anti-virus immune response. Poor immune reactivity has made the elucidation of protective anti-retroviral pathways an incredibly arduous endeavor. There are, however, rare individuals capable of mounting a potent anti-retroviral immune response, and the study of these individuals has allowed dissection of the protective responses. For example, some Human Immunodeficiency Virus (HIV)-infected individuals termed `long-term or elite non-progressors' are able to initiate and maintain robust anti-viral responses via specific genetic mechanisms. Whereas studies of retrovirus resistance in humans are complicated by genetic diversity, inbred mice offer an experimentally tractable alternative for mapping mammalian resistance and susceptibility genes. Two examples of such models are mice from the C57BL/6J (B6) and I/LnJ strains, which successfully constrain retroviruses via production of neutralizing antibody (Ab) responses. Whereas the gene responsible for controlling Murine Leukemia Virus (MuLV) in B6 mice has been identified (apobec3), the gene underlying retrovirus resistance in I/LnJ mice remains unknown. We have previously described a virus infectivity controller 1 (vic1) locus, containing a recessive retrovirus resistance-conferrng gene in I/LnJ mice and mapped it to Chromosome 17. Unlike apobec3, vic1 confers resistance to two distinct retroviruses, MuLV and Mouse Mammary Tumor Virus (MMTV). Although an initial poly-isotypic anti-virus immune response is observed in susceptible mice, it is short-lived and does not class-switch to an IgG2a response as it does in resistant ILn/J mice. Unlike virus-susceptible mice, I/LnJ mice infected with either retrovirus produce virus-neutralizing Abs, sustain this response throughout their life, and prevent infection of progeny by coating secreted virions with anti-virus Abs. Using congenic and bacterial artificial chromosome (BAC) transgenic approaches, we fine- mapped the vic1 locus to a 32.9Kb region between 34,211,575 -34,244,528 Kbs. A non-classical major histocompatibility class II (MHCII) gene, H2-Ob (Ob) mapped within the region was identified as the gene encoding for Vic1 by virtue of its known function, unique polymorphism and a phenotype rescue experiment. Peptide loading of MHCII molecules in the endosomes of antigen presenting cells (APCs) is catalyzed by H2-M. The evolutionally conserved Ob encodes the O? molecule that together with O?, comprises the heterodimeric H2-O molecule. H2-O is a MHCII mimic and binds to H2-M thereby inhibiting MHCII peptide presentation. The biological relevance of H2-O inhibition of MHCII peptide loading is poorly understood. Importantly, the role of H2-O during the immune response against any pathogen is completely unexplored. The successful completion of aims described in this application will reveal the mechanism by which the MHC-like molecule, H2-O controls the immune response to retroviruses."
"9182821","DESCRIPTION (provided by applicant): Epoxides are three membered cyclic ethers which can be toxic and mutagenic. They are degraded by enzymes known as epoxide hydrolases (EHs), which add water to epoxides to yield more water soluble diols. EHs are widely known for metabolizing xenobiotics, and this project advances our understanding of their fundamental structure, biochemistry and regulation. The soluble epoxide hydrolase (sEH) is the most abundant and active of the EHs in mammals, and it is largely involved in the hydrolysis of endogenous epoxides on natural fatty acids (EpFAs). Since EpFAs are powerful chemical mediators previously shown to reduce inflammation, hypertension, heart failure, and pain, their hydrolysis by the sEH can give rise to disease states. In this project we will test the hypothesis that the levels of EpFA and sEH are influenced by environmental factors, dietary status, and disease states. We also will test if decreasing sEH activity increases EpFA resulting in improved health. In Aim I, we will investigate the biochemistry of the sEH, as well as the microsomal EH (largely responsible for the metabolism of xenobiotics) and the newly discovered EH3. We will determine the relative roles of the sEH, mEH and EH3 in hydrolysis of bioactive EpFA. These biochemical and structural studies will allow prediction of the biological effects resulting from genetic alterations in human sEH. Anti-microbials in some hand soaps and some drugs are powerful inhibitors of the sEH while other environmental chemicals and drugs are powerful inducers. We will determine how these materials alter biologies regulated by the sEH and EpFA. Aim IIA is expanding analytical methods for regulatory lipids altered by disease states, environmental chemicals and drugs. These methods are being used to address the influence of environmental chemicals and nutrition on the sEH. The biochemical tools from Aim I and the analytical tools from Aim IIA will be used in Aims IIB-D to investigate how changes in the sEH and EpFA alter three separate biologies. In IIB we demonstrate that inhibition of the sEH blocks convulsions and reduces perception of inflammatory and neuropathic pain. With pain, inflammation and hypertension, we have shown that sEH inhibitors are more effective in the presence of epoxides of omega 3 rather than omega 6 fatty acids. With an increase in the use of omega 3 lipids as nutraceuticals and value added ingredients, an appreciation of their health effects is critical. We recently demonstrated EpFA from omega-3 and -6 precursors have opposite effects with sEHI on angiogenesis, allowing sEH inhibitors to reduce tumor growth and metastasis when combined with omega 3 EpFA (Aim IIC). This raises the possibly of new cancer therapeutics but cautions that omega 3 lipids could slow wound healing. Aim IID addresses how sEH inhibitors block hepatic fibrosis caused by carbon tetrachloride. We will test the hypothesis that there are common mechanisms underlying the largely beneficial biological effects of reduced sEH activity. The results of this project will illustrate the importance of man' total environment, including both xenobiotic exposure and nutrition, on health."
"9179665","?    DESCRIPTION (provided by applicant): Despite recent advances in biomedical sciences, effective treatment options remain limited for patients suffering from neuropsychiatric diseases. While the underlying etiology and pathophysiology remain unclear for majority of the human cases, it has become increasingly clear that early neurodevelopmental defects can be a contributor to behavioral sequelae later in life. Recently, neural progenitor proliferation and differentiation abnormalities have been described in mouse models of human neuropsychiatric disorders. The postnatal rodent subventricular zone (SVZ) niche around the lateral brain ventricles is a specialized environment housing GFAP+ astrocytes functioning as neural stem cells (NSCs), producing mainly GABAergic interneurons. Postnatal SVZ neurogenesis is regulated by NSC-intrinsic mechanisms, interacting with extracellular/niche-driven cues. It is generally believed that these local effects are responsible for sustaining neurogenesis, though behavioral paradigms and disease states have pointed to possibilities for higher-level modulation. It is currently unclear if activity states from groups of neurons, or discrete neural circuits can directly control postnatal SVZ neurogenesis. We have identified acetylcholine (ACh) release by neuronal terminals into the SVZ niche. Our preliminary results have uncovered a previously undescribed population of cholinergic neurons, projecting their processes directly onto SVZ NSCs. Optogenetic stimulation or inhibition of these novel cholinergic neurons resulted in measurable electrical current induction in SVZ NSCs and concurrent changes in the rates of neurogenesis. We plan to further explore these observations by determining the following: 1) which higher-level brain regions provide excitatory drive to induce ACh release in the SVZ; 2) what are the molecular mechanisms required in SVZ NSCs downstream of ACh activation to promote neurogenesis; and 3) which are the SVZ niche cellular structures/organizations that can transform neuronal firing frequencies into NSC proliferation and increased neurogenesis. Our study proposes to explore a direct connection between neuronal activity from cholinergic neurons and postnatal SVZ NSC proliferation. To make this research question tractable, we have developed new mouse reagents, as well as optogenetic and live-imaging platforms to directly measure the interactions between neuronal activity patterns and SVZ neurogenesis. We believe these findings will have a positive impact by vertically advancing our functional understanding of postnatal SVZ neurogenesis control by circuit-level activity, with potentially important implications for cholinergic circuit dysfunctionin neuropsychiatric diseases."
"9171946","DESCRIPTION (provided by applicant): We study Salmonella-host interactions and have shown that a host regulator of fatty acid metabolism, PPAR?, controls persistent systemic S. Typhimurium infection in mice. PPAR?, a transcriptional factor that plays a role in regulating metabolic and immune pathways, is specifically upregulated in Salmonella- infected macrophages. Importantly, PPAR?-deficient mice are not chronically infected with S. Typhimurium. The long-term goal of this research proposal is to understand how S. Typhimurium usurps and manipulates host metabolic and immune activities during chronic infection. In Aim 1, we will use genetic and biochemical approaches to identify mechanisms of Salmonella-dependent activation of PPAR?. In Aim 2, we will identify the PPAR?-dependent immune and metabolic pathways required for Salmonella replication in macrophages. In Aim 3, we will use germ-free mice and mice deficient for PPAR? in macrophages or gut epithelial cells to characterize PPAR?-dependent mechanisms of Salmonella persistence in the gastrointestinal tract. These studies are aimed at gaining a better understanding of the molecular mechanisms of host-pathogen interactions during chronic infections, which will lead to the rational design of therapeutics that will benefit public health."
"9379560","The Morehouse School of Medicine G12 Multidisciplinary Biomedical Research Center (G12/MBRC) research goal is to build a critical level of biomedical research capability, productivity, and training that will allow MSM to pursue multidisciplinary approaches to discovery science that translate into the amelioration of health disparities. MSM has experienced growth and success of its research enterprise over the past decade based on a strategic plan that focuses our talent and resources in discrete areas. The G12/MBRC proposal builds on this foundation developed with careful stewardship and investments of RCMI resources. Our approach is to enhance the research capacity in biomedical science by building effective inter- and intra-institutional partnerships synergizing/leveraging the collective strengths of our faculty, trainees, students and collaborators. The G12/MBRC institution-wide framework and key activities are designed to promote transformative changes in our research environment enhancing our research capacity in biomedical research, ultimatelly enhancing our clinical/translational science through the following specific aims: Aim I: Transform Our Institution: Provide an organizational framework; Support a culture of collaboration between institutional units and between institutions; rework the TTP financial framework to enhance research development in multidisciplinary biomedical and translational science. Aim II: Transform Our Research Environment: Provide a robust research infrastructure/training environment fostering innovative, multidisciplinary biomedical/translational research. Aim III: Transform the Community of Biomedical Scientists: Provide an institution-wide resource that: (i) leverages existing training programs and integrates research project support and mentorship enhancinig research training/career development; (ii) incentivizes collaborative, multidisciplinary research; (iii) synergizes research support and core technology mentorship to enhance research training/career development and expand the intellectual property portfolio at MSM. Overall, the implementation of these specific aims will enable MSM to fulfill its long term goal of translating discovery science into community-based solutions that ameliorate health disparities."
"9171940","DESCRIPTION (provided by applicant): The goal of the proposed research is to identify novel mechanisms that regulate type 2 innate lymphoid cells (ILC2). ILC2 are a recently discovered population of lineage-negative lymphocytes that produce Th2 cytokines in response to epithelial cytokines IL-33 and TSLP. ILC2 contribute to an asthma phenotype in animal models and are present in human lungs. Specifically, we hypothesize that the RNA-binding protein RBM3 controls human and mouse ILC2 Th2 cytokine production and innate type 2 lung responses through Th2 cytokine mRNA stabilization. We will administer allergen, IL-33, and TSLP challenges to the airways of WT and RBM3 knockout mice and assess lung ILC2 Th2 cytokine production and proliferation, as well as levels of BAL eosinophils, epithelial mucus production, peribronchial infiltration and airway hyperresponsiveness. We will also perform ILC2 adoptive transfer studies and generate RBM3 deficient IL-13 reporter mice to define the role of RBM3 in ILC2 during allergen, IL-33, and TSLP-induced airway inflammation. We will perform in vitro studies with purified ILC2 from WT and RBM3 knockout mice as well as human RMB3 siRNA knockdown ILC2 stimulated with IL-33 and TSLP and assess levels of ILC2 Th2 cytokine production and proliferation. Further, we will perform mRNA stability assays to determine whether RBM3 controls ILC2 function by stabilizing Th2 cytokine mRNAs. We expect to find that RMB3 promotes ILC2 Th2 cytokine mRNA stability and controls ILC2 Th2 cytokine production in vitro and in vivo. The novelty of the proposed studies includes use of novel reagents (RBM3-/-, RBM3-/-RAG2-/-, and RBM3-/-/YFP-IL-13 reporter mice) and uncovering a novel pathway (RNA binding protein) regulating a recently discovered cell type (ILC2) that contributes to allergic inflammation. Importantly, the discovery of molecules that regulate ILC2 function may reveal novel therapeutic targets to reduce ILC2 activation in asthma and allergic disease."
"9128439","Core C (Biostatistics & Data Management) provides expert support in the biostatistical aspects of the design, conduct and statistical analysis of research projects generated under the U54 and in the design and operation of database management systems. Core members will 1) work with investigators to select valid observational study designs, 2) design effective database management systems for storing and exporting relevant data, 3) interface closely with the Shared Resources Core, in the design of data collection tools and quality assurance methods, 4) conduct efficient and robust data analyses, create graphs and tables, assist investigators with the preparation of presentations and manuscripts, and consult on the design of subsequent research, and 5) serve as a statistical mentor in the Mentoring/Career Development Core. Core statisticians have extensive experience supporting HIV/AIDS and cancer research of all kinds and have existing collaborations with the Project leaders at their respective institutions. The Core's database programmer has comprehensive experience in developing databases, data queries/quality assurance procedures and data extraction programming to generate statistical analysis-ready files. We are thus highly qualified to provide biostatistics and data management support of the highest quality to the U54 research projects."
"9194946","ABSTRACT Support is requested for a Keystone Symposia meeting entitled Biologics as Drugs: Novel Strategies for Better Treatments of Human Disease, organized by Drs. Cheri L. Butts, Amy S. Rosenberg, Amy D. Klion and Sachdev S. Sidhu. The meeting will be held in Snowbird, Utah from January 22-26, 2017. The purpose of this meeting is to examine different approaches to treating diseases associated with aberrant immune responses (cancer, fibrosis, autoimmunity, and inflammatory conditions). The program will provide insights from academic and industry scientists on innovative biologics technologies and treatment strategies for ameliorating disease in an effort to identify synergies and opportunities to cross-fertilize approaches. Furthermore, the meeting includes perspectives from the US Food & Drug Administration and how the outlined strategies will impact the drug review and approval process. The intention is to better inform meeting attendees of current/future strategies for treating disease and best practices for transforming concepts into approved drugs. This area of research is of importance to NIAID as it provides strategies for improving public health and a forum addressing its mission of better understanding and treating immunologic disease."
"9189744","The purpose of this project is to develop an intervention to improve psychosocial functioning and quality of life for older Veterans with partial and full PTSD. This project will develop, implement, and evaluate a group protocol geared toward restoring older Veterans with PTSD to better, fuller functioning. Data collected as part of the proposed project will be used as pilot data (and to calculate effect size estimates) in support of a future clinical trial to evaluate the effectiveness of the intervention. Specifically, the aims of the current study are to 1) Develop a group-based intervention for older Veterans with PTSD that targets areas of psychosocial functional impairment, 2) Conduct focus groups with older Veterans with PTSD and revise the intervention after review of feedback provided by the expert panel and in the focus groups, 3) Implement pilot groups, examine feasibility, acceptability, retention, and satisfaction, and revise protocol as indicated, and 4) Implement and evaluate the intervention protocol through comparison of the intervention with a support group control. Consult expert panel and finalize intervention protocol.  The intervention protocol will consist of 10 weekly 90-minute group sessions. Groups will include 8-10 Veterans aged 60 and older with PTSD symptoms. After an initial protocol development phase, two focus groups with older Veterans with PTSD will be conducted. Two pilot groups will be conducted to examine feasibility and Veteran satisfaction with the intervention. Three intervention and three support groups will be conducted to facilitate comparison on primary and secondary outcomes such as psychosocial functioning, quality of life, and PTSD and depressive symptoms. An expert panel of PTSD clinicians and researchers will be consulted throughout this project to guide content development of the intervention and to contribute to the revision of the intervention protocol.  Advanced training and education is sought by Dr. Pless Kaiser to improve her knowledge base in the following areas: 1) development of skills in the effective facilitation of focus groups as well as group treatment with older adults, 2) enhance knowledge of clinical issues, intervention development, and appropriate assessment measures and strategies relevant to working with older Veterans, 3) improve her understanding of qualitative and quantitative research methodology and data analysis and (4) further her knowledge of intervention outcome research methodology and clinical trial research, in preparation for future investigations. The combination of seminars, didactics, graduate-level courses, collaborations with mentors, meetings, and directed readings proposed in this application will facilitate the applicant?s long- term goal of becoming an independent VA investigator with a dual focus on furthering our understanding between stress, aging, PTSD, and reactions to trauma as well as working to develop additional interventions to improve quality of life for older Veterans. ."
